1	工艺工程师	https://www.lagou.com/jobs/6823028.html	工艺工程师	智能硬件	5k-10k	全职	广州	南沙区	榄核镇顺河村平顺街16号万隆工业园	大专及以上	3-5年	2020-03-27	岗位职责：1、负责新产品的导入、试产的安排、生产指导；开发过程对生产工艺、产品性能、组装进行分析研究，并给出改良改进方案；2、负责对现场产品作业指导书、BOM表、产品加工工艺、工程变更通知单（ECN）制作与管控；3、负责对现场产品制程辅助治工具、夹具的制作与维护；4、处理生产制造中产品问题，确保产品品质满足标准要求，满足交付期要求。5、完成上级安排的临时性工作.任职要求：1、大专及以上学历，工科专业毕业；2、3年以上塑胶、电子电器、机械结构产品PE或ME及工艺工程师经历；3、2年研发工程跟进、产品生产加工制造跟进工作经验；4、熟练使用office办公软件及CAD﹑Pro/E等工程绘图软件。	GANcube	150-500人	文娱丨内容,其他	未融资	优秀团队|五险一金|行业**|智能科技
2	工艺工程师	https://www.lagou.com/jobs/6934285.html	工艺工程师	电路设计|硬件开发|系统集成	5k-8k	全职	上海	浦东新区	广丹路222弄2号楼	本科及以上	应届毕业生	2020-03-27	1、负责公司工艺技术工作和工艺管理工作。组织制定工艺技术工作近期和长远发展规划，并制定技术组织措施方案。2、编制产品的工艺文件，制定材料消耗工艺定额；根据工艺需要，设计工艺装备并负责工艺工装的验证和改进工作；3、工艺人员要深入生产现场，掌握质量情况；指导、督促解决生产中出现的技术问题，搞好工艺技术服务工作。4、负责新产品图纸的会签和新产品批量试制的工艺工装设计，完善试制报告和有关工艺资料，参与新产品鉴定工作。5、承担工艺技术管理制度的起草和修订工作，组织相关人员搞好工艺管理，监督执行工艺纪律。6、组织领导新工艺、新技术的试验研究工作，抓好工艺试验课题的总结与成果鉴定，并组织推广应用。搞好工艺技术资料的立卷、归档工作。7、积极开展技术攻关和技术改进工作，对技术改进方案与措施，负责签署意见，不断提高工艺技术水平。8、完成各项临时任务岗位要求：1、大专及以上学历，机械设计、机械设计制造及自动化相关专业，3年以上同岗位工作经验2、具备机械设计或者机械设计及自动化等相关专业知识3、熟练掌握机械加工的基础知识，熟练掌握Solidworks或者AutoCAD等机械制图软件4、要求具有一定的设备或者产品工装设计工作经验5、有较强的动手能力，能够操作车、铣、钻等机械加工机床或者加工中心者优先6、熟悉医疗器械质量体系ISO9001、13485或GMP质量管理规范者优先	纳米维景医疗科技	50-150人	医疗丨健康,软件开发	天使轮	二次调薪|补充医疗
3	工艺工程师	https://www.lagou.com/jobs/6912492.html	工艺工程师	医疗健康	6k-8k	全职	深圳	南山区	桃源街道平山民企科技园6B栋2层201	大专及以上	1-3年	2020-03-26	素质要求：1.电子、电气、机械相关专业大专及以上学历；2.一年以上PCBA维修工作经验，一年以上测试相关工作经验，有医疗设备相关经验优先；3.精通AutoCAD，ProTel，了解电子、电气、机械相关基础知识；4.熟悉产品、工艺流程，有良好的协调能力和解决问题能力；5.熟悉测试仪器的使用及维护，测试环境的搭建。工作职责：1.样机试产中协助测试环境的搭建，并协助输出搭建方案；2.对测试方案提出改进并跟进；3.测试工装家具的验证，并提出改进意见；4.负责公司产线不良品及返修配件的分析、诊断、维修工作；5.测试及维修相关文件的编制。	普特生物医学	150-500人	医疗丨健康	不需要融资	周末双休|项目奖金|地铁沿线|发展机会
4	工艺工程师	https://www.lagou.com/jobs/6592382.html	PE工程师（生产工艺）-深圳	智能硬件|移动互联网	10k-20k	全职	深圳	南山区	后海大道2378号芒果网大厦1901室	本科及以上	5-10年	2020-03-27	工作职责：1、负责新产品开发过程中可制造性设计评审和验证；2、负责新产品导入相关工作，试制生产指导和跟踪，协调解决生产中的异常问题，将新产品快速导入量产；3、主导外协OEM工艺技术指导，并对产品工艺进行持续改善，提升生产效率；4、主导自动化的导入及验证；5、负责量产制造阶段的问题，针对问题可以有效的解决；6、参与生产质量问题处理，为质量改进提供工艺依据；工作要求：1、智能硬件产品经验优先考虑；电工、照明产品工程师经验者优先考虑2、本科以上学历，机械电子、电子相关专业，有2年以上工作经验；3、熟悉电子产品的生产流程、熟悉电路板焊接和电子产品装配流程；4、具有好的创新、实施、组织及其沟通协调能力；5、会使用PADS、Cadence、CAD或solidworks等设计软件者优先考虑；6、工作认真负责，有强烈的事业心、上进心，具有良好的团队合作精神	涂鸦智能	500-2000人	移动互联网,硬件	C轮	独角兽|行业精英
5	工艺工程师	https://www.lagou.com/jobs/6778090.html	工艺设计工程师	电子/半导体/集成电路	7k-9k	全职	济南	高新区	舜华西路699号神思科技园	本科及以上	1-3年	2020-03-27	岗位职责：1、负责终端产品设计、开发、制造过程中的工艺技术部分，配合项目组负责人完成项目产品工艺方案确定；2、根据项目特点设计工艺流程、组件加工、整机装配、整机测试的工艺方案以及相关工艺文件的编制；3、跟踪试流过程，协调解决新品试流过程中出现的工艺问题；4、解决生产过程中出现的工艺问题，不断优化产品的工艺方案。任职要求：1、30岁以下，电子、通信、物理等理工类相关专业，全日制本科及以上学历；2、1年以上工作经验，熟悉AltiumDesigner、PRO/E或Solidworks等设计软件，熟练使用AutoCAD的设计软件；3、熟悉电子元器件、整机装配工艺、测试工艺设计、手工焊接工艺以及SMT工艺流程，了解机械加工、结构设计、电子产品可靠性等方面的知识；4、熟悉产品设计流程，对产品的可制造性、可测试性、可维护性设计有一定的了解；5、了解质量、信息安全、环境职业健康安全体系的有关知识，具备良好的文档写作能力、沟通能力。	神思电子	500-2000人	人工智能	上市公司	五险一金|餐补|带薪年假|节日福利
6	工艺工程师	https://www.lagou.com/jobs/6866945.html	整机工艺工程师	硬件制造|汽车	25k-40k	全职	东莞	东莞市市辖区	溪流背坡村	本科及以上	5-10年	2020-03-27	工作地点：西安、东莞、上海岗位职责：1.参与项目整机设计各阶段的设计评审2.与各领域进行交流和沟通DFM设计和生产试制问题，进行方案设计和评审3.参与产品机械类故障的分析和处理；组织过程失效模式分析4.参与样机验证及生产导入。岗位要求：1.掌握新能源汽车或电源产品结构、整机工艺的详细设计、实现、验证、BOM、改进与维护等工作；2.掌握基本的结构专利申请、结构包装设计、工业设计基础、需求分析方法、标准规范等相关信息和知识。掌握结构开发切换管理方法和技术立项等；3.机械、机电类相关专业本科毕业以上，具有扎实的专业基础、较强的分析能力；4.5年以上新能源汽车或电源产品整机工艺工作经验；5.工作积极主动，有强烈的责任心和严谨的工作作风，良好的协作沟通能力和团队合作精神。	华为技术有限公司	2000人以上	通讯电子	不需要融资	竞争力的薪资|奖金回报|股权激励
7	工艺工程师	https://www.lagou.com/jobs/6861160.html	百度地图工艺工程师	地图|移动互联网	15k-20k	全职	北京	海淀区	高科岭17号楼北楼3层	本科及以上	1-3年	2020-03-27	工作职责：1、负责情报生产工艺的优化；2、负责情报生产相关规范的制定和编写；3、负责生产问题的分析和解答；4、负责人员技能提升和培训；5、负责情报平台需求的评估；6、负责情报平台的优化，落地推动和效果监控任职要求：1、地理，测绘相关专业理工类本科及以上；2、熟练使用visio，Mindmaster，Excel等流程图或脑图类文档软件的技能；3、具备优秀的文档写作能力和总结分析归纳能力；4、具备培训考核、地图工艺相关经验者优先；相关互联网地图或平台工具设计经验者优先	长地万方	2000人以上	数据服务,移动互联网	上市公司	弹性工作|发展空间大|平台高|领导好
8	工艺工程师	https://www.lagou.com/jobs/6848174.html	百度高精地图工艺工程师	地图|移动互联网|数据分析	10k-15k	全职	北京	海淀区	高科岭17号楼北楼3层	本科及以上	1-3年	2020-03-27	职责描述：1、负责定义数据规格、制定产品工艺方案、标准规范；2、负责地图数据发展趋势，竞品分析，提供决策支持和管理支撑；3、负责高精地图数据处理平台设计与功能方向相关工作，包含平台设计-平台落地-持续迭代全流程；4、深入理解数据制作工艺及用户场景，结合平台技术能力，设计高效的人机交互系统流程及功能；5、协同自动驾驶团队，共同制定业务需求。任职要求：1、逻辑清晰，擅于从复杂的现象中拆解问题，看到问题的本质2、敏锐的同理心，擅于理解与发现需求，抓住用户本质痛点3、创新思维好，勇于突破现有的框架和局限，找到新的更好的解决方案4、推动力强，推动各个部门协作，高效执行	长地万方	2000人以上	数据服务,移动互联网	上市公司	弹性工作|发展空间大|平台高|领导好
9	工艺工程师	https://www.lagou.com/jobs/6911835.html	汽车技术支持工程师（总装工艺）	汽车	10k-15k	全职	广州	天河区	松岗大街8号小鹏汽车智能产业园区	本科及以上	3-5年	2020-03-27	主要职责：1.制订车辆维修性技术条件、维修性检查与验证、竞品车辆维修性优缺点分析报告；2.独立开展新产品维修性可行性分析，参与开展新产品竞争车型维修性分析；3.车辆设计阶段进行维修性虚拟验证，确保车辆下线达到基本维修要求；4.车辆试制阶段验证样车的实际维修性，提前规避量产车的相关问题；5.完成公司交办其他相关工作。基本任职要求：1.本科及以上学历，车辆工程、汽车运用、机械工程等相关专业，5年以上汽车研究院、整车厂以及汽车设计公司等相关工作经验；2.具备维修性工艺同步工程、工艺问题分析和解决能力；3.具备维修性工艺规划和设计能力；4.具有不小于其中一种能力：整车集成、总装工艺、车辆维修；5.英语CET-4级别及以上，能够熟练运用常用工程设计、办公软件；有较好的沟通、协调、组织、策划能力。	小鹏汽车	2000人以上	汽车丨出行	B轮	互联网大厂|行业领先
10	工艺工程师	https://www.lagou.com/jobs/6773762.html	Mini LED设备与工艺工程师(...	电子/半导体/集成电路	6k-12k	全职	北京	大兴区	亦庄经济技术开发区西环中路	本科及以上	1-3年	2020-03-26	工作职责:1、生产工艺优化及配套生产设备检讨；2、设备工艺参数调整、管理及生产保障；3、不良解决工艺改善；4、新产品新技术新材料验证及导入；5、技术文件、标准文件编制；6、In-Line、ET、PM等相关工作。任职资格:教育程度:本科工作经历:熟悉TFT-LCD、OLED等生产及工艺流程、有设备检讨经历、熟悉工艺开发、新产品导入、不良FA流程或有SMT行业相关工作经验者优先所需专业:机械自动化类、电子光学类、材料类等理工类专业其他要求:良好的沟通理解能力、工作组织与执行能力、熟练使用Office办公软件语言要求:英语4级或同等水平	京东方	2000人以上	物联网	上市公司	发展前景好|新兴领域
11	工艺工程师	https://www.lagou.com/jobs/6772350.html	拉丝工艺工程师	电子/半导体/集成电路	4k-7k	全职	武汉	东湖新技术开发区	高新五路80号	大专及以上	应届毕业生	2020-03-27	岗位职责：1.负责特种光纤拉丝工作；2.负责拉丝设备日常维修保养工作；3.负责对拉丝过程中出现的质量问题进行上报；4.负责提出对产品的改进建议。任职要求：1.全日制大专及以上学历（光学工程、光学仪器、光纤光学、光电子学、物理学、机械、电子工程或其它相近专业）2.熟悉MicrosoftOffice软件；3.有团队合作精神，责任心强。	安扬激光	50-150人	硬件,其他	不需要融资	五险一金|包住|中餐补贴|补充商险|旅游
12	工艺工程师	https://www.lagou.com/jobs/6793815.html	总装工艺工程师/专家-无人...	硬件开发	25k-45k	全职	北京	朝阳区	望京国际研发园恒基伟业大厦B/C座	本科及以上	5-10年	2020-03-27	美团的使命是“帮大家吃得更好，生活更好”。作为中国领先的生活服务电子商务平台，公司拥有美团、大众点评、美团外卖、美团打车、摩拜单车等消费者熟知的App，服务涵盖餐饮、外卖、打车、共享单车、酒店旅游、电影、休闲娱乐等200多个品类，业务覆盖全国2800个县区市。2018年9月20日，美团点评（股票代码：3690.HK）正式在港交所挂牌上市。当前，美团战略聚焦Food+Platform，正以“吃”为核心，建设生活服务业从需求侧到供给侧的多层次科技服务平台。与此同时，美团正着力将自己建设成为一家社会企业，希望通过和党政部门、高校及研究院所、主流媒体、公益组织、生态伙伴等的深入合作，构建智慧城市，共创美好生活。工作职责：1.负责无人车总装工艺同步工程分析工作；2.负责无人车总装工艺文件编制、总装工艺体系建设等工作；3.负责无人车总装厂房整体规划、生产线工艺规划、工作布局及工艺方案编制等工作；4.负责汽车产品总装生产线建设，含招标技术文件编制、招标过程技术支持、设备选型、设备进度管控、设备安装与调试管控、产线验收工作；5.负责生产过程中的技术质量问题及设备问题的分析调查，组织纠正和预防措施的实施。职位要求：1.本科及以上学历，具有5年以上车辆行业工作经验及总装工艺规划管理经验；2.具有丰富的总装工艺知识及总装工艺同步工程分析能力；3.熟悉总装工具及设备，具备总装产线工具及设备选型能力；4.具备总装生产线设备图纸审核能力；5.具有较强的总装工艺问题解决经验；熟练使用日常办公软件、三维二维绘图软件；5.具有较强的团队协作能力，易沟通，抗压能力较强，能吃苦耐劳。	美团点评	2000人以上	消费生活	上市公司	自动驾驶前瞻技术|大落地场景|牛人云集
13	工艺工程师	https://www.lagou.com/jobs/6726369.html	地图工艺工程师	地图	10k-20k	全职	武汉	东湖新技术开发区	光谷大道金融港B14栋 5楼	本科及以上	1-3年	2020-03-26	1.负责地图数据生产、上线和运营的工艺设计、优化；2.提高作业效率和质量，提出合理的技术创新思路，持续推进数据改善。岗位要求：1.统招本科及以上学历，地理信息系统、统计学等相关专业，具有数据生产2年以上工作经验；2.具有良好的服务精神，团队协作和业务协调能力；3.主动思考、严谨逻辑、积极心态、独立解决问题的能力；4.拥有互联网、导航电子地图或者测绘等相关行业的数据工作经验尤佳。	丰图科技	150-500人	软件开发	不需要融资	弹性上班时间|高额餐补|试用期全薪
14	工艺工程师	https://www.lagou.com/jobs/6285683.html	工艺工程师	其他	5k-8k	全职	中山	中山市市辖区	黄圃镇健智路2号	大专及以上	3-5年	2020-03-20	性别：不限；年龄：25~35；工作经验：3年以上；专业：机械、机电、模具、自动化等相关专业，大专以上学历；专业技能1.能较熟练使用AutoCAD、PROE/CERO绘图软件等；2.熟悉五金加工钣金折弯、冲压、焊接、打磨、模具制作工艺流程及技术要求；3.掌握机械原理，能独立进行受力分析、结构分析；4.熟悉家电产品常用装配工艺，能独立解决产品生产过程中的相关问题。5.了解常用质量管理工具，能主导进行较系统的质量分析和改善；6.沟通能力强，做事认真细心，责任心强，有一定的承压能力，注重团队协作；工作方向：产品生产工艺跟进、现场质量问题解决、工艺路线制定、作业规程编制。	波茵智能家居	500-2000人	房产家居	不需要融资	待遇优厚
15	工艺工程师	https://www.lagou.com/jobs/6303481.html	后视镜工艺工程师	汽车	10k-15k	全职	北京	昌平区	昌平区昌平路97号 新元科技园C座601	本科及以上	3-5年	2020-03-26	岗位职责：1、负责新产品量产前阶段产品的质量完善；2、负责现产品的样件装配、问题汇总、实验安排和送样试装；3、负责工艺文件编制，工艺流程、材料消耗定额、转产文件等工艺技术文件；4、参与新产品的前期投入评审、工艺审查；5、负责APQP文件的整理，PPAP资料整理和提交；任职要求：1、知识：理工类相关专业，专科以上学历；工程师、工艺师以上技术职称；2、经验：3年以上汽车后视镜产品技术工程管理经验；3、技能：熟练使用三维设计相关软件。有灯镜设计、工艺及改进全套流程独立操作能力；熟悉汽车及零部件行业***动态；熟悉TS16949质量管理体系，接受过五大工具培训（APQPFMEASPC等），具有较强的组织和协调沟通能力；、熟练应用计算机办公软件；4、年龄：35岁以下；福利待遇：1、五险一金（加意外险）；2、可提供住宿（园区内有食堂）3、晋升清晰，欢迎加入；	安路普	50-150人	其他,数据服务	不需要融资	五险一金|节日福利|法定休假
16	工艺工程师	https://www.lagou.com/jobs/6484146.html	半导体光芯片工艺整合工程师	高级技术管理|技术管理	10k-20k	全职	深圳	南山区	留学生创业大厦	本科及以上	1-3年	2020-03-26	工作职责：·负责半导体激光芯片产品从设计到制造过程的整合。·负责规划及实施芯片制程新工艺的开发及优化，测试数据分析，以及撰写测试结果总结报告。·负责量产相关数据分析，提供反馈信息帮助产品设计和制造工艺的优化，以提高产品量产良率。·协助支持相关产品失效分析，根据分析结果总结失效根因，建议纠错措施。岗位要求：·本科学历，拥有硕士学位以上者优先考虑；光电子、电子工程、半导体材料、物理等相关专业背景。·有3年以上行业经验，拥有代工厂管理经验者优先；需熟悉半导体激光芯片包括VCSEL以及边发射激光器（EEL）的相关原理，设计，生产制造工艺流程及相关各项性能测试。·熟悉DOE，SPC，能够在制程工艺开发及优化中熟练运用统计学方法。·具备较强的数据分析能力；能熟练使用MATLAB,Excel,Minitab,JMP等软件。·具备较好的英语听说读写能力；能熟练使用中英文撰写专业报告。	瑞识科技	50-150人	其他	A轮	人工智能|发展前景广
17	工艺工程师	https://www.lagou.com/jobs/6791195.html	工艺工程师	信息安全|PCB工艺|工业设计|智能硬件|模具设计	4k-6k	全职	太原	小店区	龙城大街75号鸿泰国际大厦B座10层	本科及以上	3-5年	2020-03-10	岗位职责：1、负责新产品前期的可行性评估；2、参与新产品试制工作，及时分析和解决制程工艺上出现的不良问题；3、负责跟进产品投产后生产工艺改进；4、负责工厂端的技术对接及生产辅助。任职要求：1、熟练使用AD、candance等绘图软件；2、熟悉电路板焊接工艺，掌握常用电子元器件性能；3、具备较强的学习能力和分析解决问题的能力；4、具备良好的抗压能力和团队协作能力。	山西百信信息	500-2000人	企业服务	未融资	五险|餐补节日福利年终奖励双休|****
18	工艺工程师	https://www.lagou.com/jobs/6713207.html	工艺工程师	医疗健康	6k-8k	全职	深圳	南山区	南山区科技北一路15号凤凰城大厦二层	本科及以上	不限	2020-03-05	岗位职责：1、负责生产现场的技术工艺实现；2、产品质量的改善；3、工艺技术的进步与标准化；4、负责项目相关的技术培训工作。任职资格：制造工艺工程师1.本科以上学历，机、电相关专业；2.两年以上电子产品组装工艺相关工作经验；3.对电子产品和机械产品有一定工程基础；4.能独立完成产品制作工艺和相关工艺文件	瀚翔生物	150-500人	医疗丨健康	上市公司	五险一金|通讯补贴|年终奖金|员工旅游
19	工艺工程师	https://www.lagou.com/jobs/6802405.html	面套安装工艺师	电商|汽车	7k-10k	全职	上海	长宁区	临虹路128号8号楼	学历不限	不限	2020-03-27	面套及座椅安装工程师职责说明：1．熟悉汽车座椅面套换装流程。2．能独立拆装汽车座椅以及面套，并对面套进行整形。3．编制产品的工艺文件，制定材料消耗工艺定额等。4．根据工艺需要，设计工艺装备并负责工艺工装的验证和改进工作。5．编制座椅、面套拆装的作业指导书。负责对公司内部以及门店合作方操作人员的培训。6．开展技术攻关和技术改进工作，对技术改进方案与措施，负责签署意见，不断提高工艺技术水平。7．能适应经常出差。招聘要求：熟练应用办公软件（EXCELPPT等）学历：大专及以上，汽车专业优先。	久舜网络	15-50人	电商,汽车丨出行	不需要融资	五险一金|年终奖3—5薪
20	工艺工程师	https://www.lagou.com/jobs/6875442.html	生产工艺主管	音乐	8k-10k	全职	广州	越秀区	华侨新村和平路2号	大专及以上	3-5年	2020-03-27	工作摘要：在拿火，你可以帮助每个渴望接触音乐的人，创造出属于下一个时代的创作工具。一个好的创意，因你的加入，将成为一个真正优秀的产品和体验。我们的团队正在研发，能帮助人更好地接触音乐的硬件产品。我们发挥团队里每个人的创意，去推动产品，从设计到材料工艺，到生产结构。所以，你需带上你的热情和追求**的态度。------------------------------------------1，核心职责：新乐器产品量产导入；生产制程的工艺布局、产线筹备、工艺标准制定2，新品导入：乐器新产品配合研发进行测试生产验证，在试产/量产过程中的问题分析改善，结合设计和可量产性，设计工装夹具，提出改善提案优化等3，量产改进：深入生产现场，发现生产异常、处理改善不良问题，向品质制定相关对策，提高工艺品质水品4，生产管理：统筹管理生产线的人员/设备/生产环境；起草和落实量产相关文，并与各部门协调相关安排，下达生产要求，跟踪实际执行情况5，工艺开发：协助研发学习新工艺、新技术，并勇于尝试创新和突破，总结工艺成果、推广应用任职要求：1，具备3-5年以上吉他乐器工厂的生产及管理经验，熟悉掌握每个生产工序流程以及制造要求。2，工作积极主动，勇于探索解决问题的方法和创新3，能适应长时间短途出差4，有较强的统筹和管理经验和能力，以及人际关系处理能力5，熟练掌握办公软件的操作，如word,excel,ppt,CAD等LAVAMUSIC拿火信息科技有限公司成立于2013年，设计并创造了LAVAGUITAR，是一家以设计与制造乐器及教育产品为核心，结合互联网创新的科技公司。深植于拿火的DNA，我们极其在乎设计不同于普遍公司追求的“低成本、走量”的价值观，我们希望另辟蹊径，仅专注于为人们创造真正出色的产品，我们不会妥协于生产及执行上遇到的各种问题，并坚信必定能找到更好的解决办法。我们选择相信，透过一个物件的整体，或每个细节，人们能够感受到背后创造者的用心专注；为人们探索最根本的解决方案，创造真正优秀的产品，最终能带来极大影响。	拿火音乐	50-150人	移动互联网	A轮	创造触动人心的设计|弹性工作|扁平化管理
