100	工艺工程师	https://www.lagou.com/jobs/6736184.html	配饰设计主管	电商	15k-25k	全职	深圳	南山区	科技园深南大道9996号松日鼎盛大厦5楼	大专及以上	3-5年	2020-03-27	工作职责:1、配合产品开发初期的市场预调研、买款等方式进行设计开发信息收集、整理对纺织面料及各类时尚材质市场进行调；2、协助总监每季设计企划，对设计主题、品类结构、风格、面料、轮廓、颜色、款式提出建议；3、根据企划方向开发设计帽子；4、依进度带领开发小组，完成设计图稿，在图稿审核通过后，跟进样品制作，直到样品完成。任职资格:1、大专或以上学历，熟悉服装或服装配饰类产品专业知识，熟悉各种面料材料工艺；2、熟悉每年每季服装或配饰产品的流行趋势与元素及最新的工艺运用；3、有很强的时尚感与审美观，对当季流行元素有独到的见解和超强的领悟能力；4、有扎实的手绘基本工熟练使用相关绘图软件。	减字科技	150-500人	电商	B轮	周末双休|扁平管理|年终奖
101	工艺工程师	https://www.lagou.com/jobs/6944809.html	衍生品设计师	创意|手绘|摄影|工业设计	12k-20k	全职	北京	朝阳区	华贸商务楼	本科及以上	3-5年	2020-03-27	职位描述1、根据公司需求进行衍生品设计开发，跟进产品打样至上线前产品生产流程、督导生产周期。2、对所开发产品材质、工艺、周期等进行把控。3、根据公司业务方向、市场需求进行新产品提案。4、其他任职资格1、3年以上设计工作从业经验；熟练使用mac系统和Adobe系列设计软件，能准确绘制产品设计图和效果图。2、艺术/设计等相关专业，手绘能力强。3、有市场和运营意识，良好的创意能力，善于沟通，有责任心强，具备团队精神和积极的工作态度。4、熟悉多种材质、工艺运用，有IP衍生品相关开发经验优先。5、有摄影技能加分。为了让我们更好地了解您，投递简历时请附相关作品图片或链接，谢谢~	罗辑思维	150-500人	移动互联网,文娱丨内容	D轮及以上	六险一金|带薪年假|企业医生|年度体检
102	工艺工程师	https://www.lagou.com/jobs/6769014.html	工业设计	工业设计|Solidworks|ProE	8k-15k	全职	厦门	集美区	软件园三期B13区1702-1703室	本科及以上	1-3年	2020-03-27	岗位职责：1.负责公司产品外观设计的具体实施，包括草绘、建模、效果图制作；2.参与行业产品趋势性研究，包括市场调查，客户产品咨询收集整理和分析，输出分析报告；3.负责设计方案实现过程中细化完善、跨部门沟通协调，手板的外观、颜色、工艺的指导与确认；4.对现有产品迭代进行优化改良设计。任职要求：1.工业设计或产品外观设计毕业，两年以上相关ID设计工作经验；2.热爱工业设计，具有开放与创新的设计思维，注重细节，追求完美；3.具有良好的美感认知，和较强的ID设计能力，熟练掌握ID外观设计软件（Solidworks、PROE、Keyshot、PS、AI）；4.对产品结构、材料、工艺有一定的认识；5.沟通协调、计划与执行力强，有消费电子类ID设计工作经验者优先。备注：面试需携带个人成功作品资料	喵宝科技	50-150人	移动互联网	未融资	年终多薪|出国旅游|过节费|七险一金
103	工艺工程师	https://www.lagou.com/jobs/4152328.html	机械设计工程师（工业机器人...	自动化	10k-15k	全职	上海	嘉定区	嘉戬公路500号上海国际健康产业园	本科及以上	3-5年	2020-03-27	岗位职责：1、负责机器人集成方案的机械机构设计；2、撰写机械系统需求文档；3、机械方案设计；运动学设计，动力学设计，以及初步方案展示；4、机械详细方案设计；5、跟进方案设计、加工、装配、调试、实施等过程中的技术问题；任职要求：1、本科及以上学历，机械、自动化等相关专业毕业；2、运动学设计，结构设计；熟练使用机械制图软件；3、结构设计能力：器件选型，熟悉传动设计，机构设计；熟悉电机选型；熟悉气动设计；4、熟悉加工工艺，装配工艺；分析问题能力，解决问题能力；5、机械结构设计知识，具备集成自动化相关知识；6、具备工业机器人行业机械设计研究优先，有意向长期往工业机器人机械集成设计方向发展；7、良好的沟通能力，文档撰写能力，分析能力。	梅卡曼德	150-500人	企业服务,硬件	B轮	股票期权|绩效奖金|扁平管理|岗位晋升
104	工艺工程师	https://www.lagou.com/jobs/6750029.html	结构工程师	模具设计	15k-25k	全职	北京	海淀区	中关村软件园	本科及以上	3-5年	2020-03-27	工作职责:1、负责公司产品结构设计，工程图出图等工作；2、负责研发过程中结构手板设计验证组装等工作；3、参与产品样机制作、测试、改进、质量提升、定型等工作；4、新产品试制生产、装配等阶段的技术指导和工艺改进、设计优化等工作；5、完成领导安排的其他工作。任职资格:1、统招本科及以上学历，机械设计、模具设计相关专业；2、3年以上消费电子产品结构设计工作经验；3、熟悉注塑、压铸、冲压等模具知识；4、精通产品表面处理工艺者优先考虑；5、精通AutoCAD、PROE。	贝壳	2000人以上	房产家居	D轮及以上	免费三餐
105	工艺工程师	https://www.lagou.com/jobs/6933103.html	总经理	其他|区域管理|部门管理|集团公司经营	7k-11k	全职	乌鲁木齐	米东区	新疆石河子开发区	本科及以上	3-5年	2020-03-27	雨润集团面向全国招聘岗位职责：负责公司的整体运营包括，生产管理任职要求：1，熟悉食品企业的各种法律法规，2，熟悉产品生产各个环节的食品工艺及国家对卤肉制品的国标规定，各关键点控制3，熟悉卤肉制品的各种理化标准、数据，食品保质期，杀毒工艺的各种要求4，熟悉食品安全的各关键控制点5，****！！	新疆雨润食品有限公司	2000人以上	消费生活,其他	上市公司	晋升空间大
106	工艺工程师	https://www.lagou.com/jobs/6552046.html	储备干部	电子/半导体/集成电路	4k-7k	全职	佛山	南海区	桂城三山大道泰山北路青松科技园	本科及以上	应届毕业生	2020-03-27	岗位职责：负责制造系统生产现场管理、生产计划分解与落实、工艺与品质流程改善等工作，往制造管理岗培养。岗位要求：理工类专业（电子、通信、自动化、机电等优先），善于学习，想往管理方向发展，并有一定组织、协调、领导能力。	佛山青松	150-500人	硬件	上市公司	免费食宿|广阔平台|高新技术企业
107	工艺工程师	https://www.lagou.com/jobs/6884899.html	采购跟单	采购|跟单	5k-10k	全职	成都	高新区	天府软件园D713F	学历不限	3-5年	2020-03-27	职位职责：1.根据公司要求进行硬件产品的供应链及物品采购2.负责电子商品的样品及生产进度跟进3.采购订单整理，相关合同核对整理，出货对账及付款安排任职要求：1.熟悉电子硬件产品技术工艺及生产流程2.认真负责切清楚采购流程3.沟通能力强，能妥善协调沟通处理生产中及售后出现的品质问题4.有管理经验优先	咕咚	150-500人	移动互联网	C轮	发展前景好|公司氛围好
108	工艺工程师	https://www.lagou.com/jobs/6941190.html	生产跟单（内衣）	电商	8k-12k	全职	深圳	南山区	蛇口兴华路南海意库1栋505	大专及以上	3-5年	2020-03-27	岗位职责：1.熟悉内衣产品信息及工艺标准，编制管辖内工厂产品生产工艺单，依照审批确认的工艺单内容批复加工厂的头版、齐码版、产前版、大货版等各类版样。2.参与内衣内裤品类新品开发工艺版型的论证鉴定工作；复核内衣内裤品类产品生产工艺信息。3.对生产中出现的典型工艺问题进行分析，提出合理化改进方案。4.负责管辖内工厂新产品的对版对色的批复工作。5.负责跟踪管辖内工厂生产订单的生产过程、生产进度、流程、品质及交货期。6.负责管辖内工厂产品加工环节的前中后期质检工作。7.负责管辖内工厂批次出货数量信息的整理，并及时通知仓储、运营及客服部门。8.负责管辖内重点合作加工厂员工绩效考核统计工作，核算补贴金额方案。9.负责管辖内工厂产品加工需要的辅料进度跟进、到厂抽检盘点确认、数据统计、信息反馈工作。10.处理质量问题退厂工作，跟进订单对账及付款业务。11.负责所辖供应商的关系维护及管理工作。12.完成领导交办的其他事务性工作。任职要求：**大专及以上学历，服装结构相关专业1、3年以上服装或内衣相关产品跟单经验，熟悉公司及行业知识，掌握公司业务及工作流程；2、掌握服装各品类生产工艺规范，熟悉生产加工流程；3、了解各类产品国家标准，熟悉企业标准；4、有良好的协调能力及沟通能力，较强的责任心和行动力；5、具备一定的应变能力，电脑操作熟练，能接受出差。	三立人（深圳）科技有限公司	150-500人	移动互联网,电商	天使轮	六险一金|年终奖|浮动奖金
109	工艺工程师	https://www.lagou.com/jobs/6755918.html	腾讯公益教育项目经理	项目管理	18k-25k	全职	深圳	南山区	滨海大厦	本科及以上	1-3年	2020-03-27	岗位职责：负责相关学校的校董会工作；以及根据学校的战略规划，统筹教育类公益项目的实施计划、资源整合、相关方沟通及项目评估反馈等工作。1、校董会的筹备、组织、文件准备、记录管理等工作。2、协助制订校董会年度工作计划、预算及年终总结。3、与校董保持日常工作联系，信息共享、负责校董单位或个人来校的接待及相关工作。4、项目策划及计划制定：根据基金会的公益理念和项目目标，策划并制定短、中、长期项目方案及对应的预算方案；拟定并编制具体实施计划及里程碑目标。5、项目合作方沟通与激励：向合作方充分传递项目理念与目标，激励和调动合作方的积极性，并提供相关资源，协助合作方项目能力不断提升；6、内外部资源整合：基于基金会自身优势及可持续发展目标，不断整合内外部优质资源，推动项目的发展；岗位要求：1、大学本科以上学历，有互联网公司运营相关工作经验优先；2、优秀的中英文沟通、口笔译及写作能力；3、商务谈判能力强，能与内部成员及外部合作伙伴进行有效沟通和协调资源，有良好的团队合作精神；4、富同理心，有亲和力，有较好的服务意识、行程制定能力及时间管理能力；5、能熟练运用各种日常办公软件及办公设备。	腾讯	2000人以上	社交	上市公司	大平台|福利好
110	工艺工程师	https://www.lagou.com/jobs/6385193.html	工业设计师	音视频处理	25k-50k	全职	北京	海淀区	中关村南四街18号紫金数码园四号楼	本科及以上	3-5年	2020-03-27	职位职责：1、新产品造型与外形设计（设计调研、草图创意、2D、3D、外观手版跟踪、产品设计的造型跟踪，后期工艺和配色），外包装设计、产品画册及产品目录设计等；2、量产跟踪，量产产品外观品质管控；3、奖项申报等部门其他相关工作；4、新材料和工艺研究。职位要求：1、本科及以上学历，工业设计类专业；2、5年以上消费类电子产品工业设计工作经验；3、熟悉产品加工工艺及制成、了解成本、有量产经验。	字节跳动	2000人以上	文娱丨内容	C轮	六险一金|弹性工作|免费三餐|租房补贴
111	工艺工程师	https://www.lagou.com/jobs/6808872.html	服务器结构工程师	后端开发	18k-35k	全职	北京	海淀区	北三环西路43号中航广场1号楼（矮楼）	本科及以上	不限	2020-03-27	职位职责：1、负责新平台服务器的结构设计开发；2、负责与各ODM厂商一起Review结构设计方案的合理性，通过优化设计提升产品质量并降低成本；3、负责整机模具设计方案的沟通及制定，优化模具设计方案，降低机箱开模成本；4、负责推动解决机箱在工程化阶段中出现的各种问题，跟进各研发阶段的整机组装适配；5、负责结构件开模阶段的所有试模工作，并完成模具的规格确认；6、负责机箱结构件功能性/可靠性等方面的验证分析，确认结构件的规格；7、负责服务器结构相关的新技术的预研，以及向实际应用的转化；8、负责服务器水冷方案的结构评估与设计导入。职位要求：1、机械设计/材料成型相关专业本科以上毕业；2、具有8年以上服务器结构设计经验，熟悉服务器产品开发流程，制造工艺等；3、对产品结构设计制造中的常见问题有很强的分析和解决能力；4、精通钣金、塑胶、压铸件等多种类型材料的结构设计特点以及加工工艺，对各种材料表面处理工艺有深入了解，熟悉模具设计；5、对产品EMI&EMC设计和热设计方面，有很强的设计经验，对相关的设计标准有较深了解；6、能独立进行服务器、消费类产品的结构设计，有整机柜设计经验者优先；7、精通Pro/ENGINEER，AutoCAD；8、具有良好的沟通和协同工作能力，工作态度严谨务实、认真细致。	字节跳动	2000人以上	文娱丨内容	C轮	六险一金
112	工艺工程师	https://www.lagou.com/jobs/6286504.html	物料采购专员	智能硬件|采购	8k-12k	全职	杭州	西湖区	蒋墩路 华策中心A座7F-12F	本科及以上	3-5年	2020-03-27	工作职责：1：负责结构件的采购执行工作。2：负责订单下达、跟进、异常问题处理，确保物料交付。3：月度财务对账、请款等相关工作。4：协助上级进行日常工作，并完成上级交代的其他任务。任职要求：1:全日制本科及以上学历，3年以上注塑、冲压、PCB、线缆等采购工作经验。2：精通注塑、线缆、PCB等其中一种加工工艺。3：熟悉采购作业流程，具备较强的供应商辅导和管理能力，具备较强的物料交付保证能力。4：责任心和执行力强，有良好的沟通协调能力、风险控制能力	涂鸦智能	500-2000人	移动互联网,硬件	C轮	领导好|成长空间大|团队氛围好
113	工艺工程师	https://www.lagou.com/jobs/6906616.html	技术开发主管工程师	汽车	10k-13k	全职	广州	天河区	松岗大街8号小鹏汽车智能产业园区	本科及以上	3-5年	2020-03-27	岗位职责：1.制订车辆维修性技术条件、维修性检查与验证、竞品车辆维修性优缺点分析报告；2.独立开展新产品维修性可行性分析，参与开展新产品竞争车型维修性分析；3.车辆设计阶段进行维修性虚拟验证，确保车辆下线达到基本维修要求；4.车辆试制阶段验证样车的实际维修性，提前规避量产车的相关问题；5.完成公司交办其他相关工作。基本任职要求：1.本科及以上学历，车辆工程、汽车运用、机械工程等相关专业，5年以上汽车研究院、整车厂以及汽车设计公司等相关工作经验；2.具备维修性工艺同步工程、工艺问题分析和解决能力；3.具备维修性工艺规划和设计能力；4.具有不小于其中一种能力：整车集成、总装工艺、车辆维修；5.英语CET-4级别及以上，能够熟练运用常用工程设计、办公软件；有较好的沟通、协调、组织、策划能力。	小鹏汽车	2000人以上	汽车丨出行	B轮	互联网大厂|行业大厂
114	工艺工程师	https://www.lagou.com/jobs/6661326.html	服装设计师	电商	5k-9k	全职	杭州	西湖区	青芝坞石虎山18号	大专及以上	1-3年	2020-03-27	岗位职责：1、依据MIPO品牌风格、当季主题独立进行童装的设计和开发；2、理解品牌风格定位，消费目标，作好每季度流行趋势及市场动态咨询的收集和整理，提供设计企划建议，并能进行服装搭配；3、沟通及表现能力强，能准确捕捉适合公司品牌风格的、具有市场时尚亮点的样衣作为开发参考资料；4、熟悉服装产品结构，服装成本结构，工艺制作，面料特性及成分，跟进样衣的打板及制作过程中工艺实施的工作，把握服装版型，配合版师修改版型；5、协助设计总监完成每季产品搭配的企划和研发；6、责任心强、团队意识强、工作效率高，能不断自我挑战，积极上进。任职要求：1.细心、逻辑思维能力佳；要求画图速度快2．本科以上学历，服装设计相关专业3．有经验者优先！！上班时间：9:00-17:30双休，法定节假日公司提供：免费午餐，五险一金，节日生日福利，团建旅游，福利体检，补充商业险，年终奖等	papa	150-500人	电商	未融资	领导nice|福利优|朝九晚五|景区办公
115	工艺工程师	https://www.lagou.com/jobs/4312067.html	空间设计师	产品设计|产品策划	7K-10K	全职	上海	青浦区	朱枫公路1226号	本科及以上	3-5年	2020-03-27	1、3D、CAD、PS等绘图软件熟练使用；2、3/5年相关工作经验，有责任心、抗压；3、能出差，对工程工艺了解，有创新精神。	荣泰健康	500-2000人	其他	上市公司	福利待遇好|员工宿舍食堂|高绩效
116	工艺工程师	https://www.lagou.com/jobs/6856865.html	供应链总监	新零售|大数据	18k-25k	全职	佛山	南海区	桂城平胜工业区平胜学校西侧东明综合楼	本科及以上	10年以上	2020-03-27	本岗位需具备餐饮行业中央厨房管理经验，不符者请勿投简历或咨询，谢谢！岗位职责：1.负责设计并改善公司供应链系统，制定完善切实可行的供应链管理工作流程，并推动实施；2.根据供应链团队，负责团队人员的培养发展、绩效考核；3.不断推动生产自动线的技术改造提升，产品工艺难点问题的改进；4.物流配送环节流程的优化，资源整合，以及各方面成本费用进行合理管控；5.分管中央厨房，优化和改善产品工艺、延长产品保鲜和保质期，规范生产加工流程，并推动落实；6.执行上级交办的其他事务。岗位要求：1.本科及以上学历，45岁以下，物流或管理类相关专业；2.熟悉大型连锁商场、超市或便利店的供应链管理模式；3.熟悉行业的生产过程与原材料的供应渠道；4.具备较强的团队管理能力和沟通协调能力，以及强大的执行推进能力。	F5未来商店	50-150人	电商,消费生活	A轮	行业前景好|政府投资|团队一线大咖|
117	工艺工程师	https://www.lagou.com/jobs/6711975.html	高级结构设计工程师(J10101)	智能硬件	20k-35k	全职	北京	朝阳区	姚家园南路1号惠通时代广场8号楼猎豹移动	本科及以上	5-10年	2020-03-27	工作职责:1.支持机器人场景落地探索；2.负责机器人整机结构设计，包括系统设计、堆叠、传感器和电机选型，快速适应更多场景。任职资格:1.机械电子类相关专业毕业，5-10年结构设计经验，尤其是具有量产经验的，偏重于机器人，汽车等行业。充分的整机结构设计技能，整体功能框架构建能力；充分了解机身设计的工艺，包括注塑，冲压，钣金，压铸，吸塑模具等工艺；2.有机械传动设计经验，熟悉电机，齿轮传动，减速箱设计等，具备机械传动设计部件的选型，校核，验证能力。根据产品需求能快速开发供应商，并形成落地方案；3.至少带领过1-2个量产品设计经验，有项目开发时间，项目管理和成本管理能力；4.具有优秀的创新性，抗压性，自驱性。能接受创业公司挑战，在公司能不断应对需求变化，调整方案；5.主动输入，需求管理强，能沟通技能良好，团队协作能力强。	猎户星空	500-2000人	移动互联网,硬件	B轮	福利多|open|牛人多|新兴行业|AI
118	工艺工程师	https://www.lagou.com/jobs/6916861.html	装备软件工程师	Windows测试|自动化	15k-29k	全职	上海	浦东新区	上海浦东新区杨高南路1998号4号楼2楼前台	本科及以上	3-5年	2020-03-27	岗位职责：1.负责手机产品生产可测试性研究，开发自动化测试制造解决方案，承担量产加工可测试性质量设计、验证与改进；2.参与手机产品研发，主导装备测试领域关键技术方案的实现，工艺方案和技术路线制定；3.主导自动化生产测试技术工艺规格制定、评估验证和改进以及技术演进和规划，提升产品竞争力；4.能定位自动化生产测试过程中的技术问题；任职要求：1、本科及以上学历，通信及软件类专业，3年以上相关工作经验；2、熟悉面向对象软件开发，精通C++，C#，熟悉MFC、COM编程；3、熟悉终端产品手机/平板/数据卡）生产测试流程，具备手机生产测试软件/工具开发的经验；4、熟悉LTE或者WCDMA或者GSM或者CDMA或者TD-SCDMA基本通信原理；5、熟悉测试仪表CMW500、EXT、MT8870、CMU200者优先；6、具备生产测试自动化开发调试经验，有终端产品生产测试从业经验者优先；7、可以接受出差和加班。	黑鲨科技	500-2000人	硬件	不需要融资	弹性工作年底双薪项目奖金大牛多交通讯补贴
119	工艺工程师	https://www.lagou.com/jobs/6893077.html	结构工程师	医疗健康|工具软件	9k-13k	全职	深圳	福田区	福田区彩田路星河世纪大厦A座1307	大专及以上	3-5年	2020-03-27	职位描述：1.根据ID设计对产品的进行结构设计；2.负责机械加工件、塑胶件和五金件的工艺过程开发；3.对接模厂进行结构设计调整，推动模具定版；4.结构相关文档、物料清单、工程图纸、组装及测试工艺工序描述等文件的编写整理；任职资格：1.能使用ANSYSworkbench有限元分析仿真软件（结构静力学、动力学，稳态、瞬态热学）；2.熟悉前期潜在失效模式分析（DFMEA）；3.熟练使用Pro/E、AutoCAD等3D、2D工程制图软件4.熟悉可用性分析要求，能针对用户可用性对设计前期风险进行判断或进行设计变更；5.有项目控制经验、跟进与改善问题的能力较强，具有团队合作精神，抗压能力强；6.有可穿戴设备结构设计项目经验以及防水产品结构设计项目经验；7.有小型医疗产品结构设计经验者优先；	旭宏医疗	50-150人	医疗丨健康,人工智能	A轮	年底双薪|绩效奖金|年终奖|周末双休
120	工艺工程师	https://www.lagou.com/jobs/6081310.html	资深室内设计师(J10716)	电商	8k-12k	全职	广州	白云区	广花3路366号欧派工业园。	本科及以上	1-3年	2020-03-27	工作职责:1.电商橱柜、衣柜活动需求方案设计；2.电商橱柜、衣柜样品方案设计；3.其他临时性安排的工作；任职资格:1、本科及以上学历艺术类专业/不限专业；年龄：24-30岁；2、3年以上厨柜、衣柜产品3Dmax效果图设计经验3、2年以上厨柜、衣柜产品三维家效果图设计经验；4、.熟悉家居产品销售模式掌握厨柜衣柜产品结构、工艺了解室内装修设计5、熟练操作AutoCAD、Autodesk3dsMax、Photoshop、三维家等制图软件	欧派	2000人以上	消费生活,硬件	上市公司	五险一金|双休|提供住宿
121	工艺工程师	https://www.lagou.com/jobs/6930505.html	视觉设计师（营销方向）	插画|移动交互|视觉	8k-12k	全职	杭州	西湖区	西溪谷国际商务中心	大专及以上	1-3年	2020-03-27	工作内容：1、参与大型整合营销设计2、线上营销页面、玩法3、线下活动策划及物料设计4、相关视频及平面素材拍摄、跟进岗位要求：1、至少2年以上广告/互联网/设计公司相关工作经验2、具有一定交互及产品思维，能够兼顾视觉表现及业务诉求3、具备线下活动策划能力、对印刷工艺有较深入了解优先4、善于沟通协作，有良好的工作态度和持续的学习能力此岗位属于驻场滴滴代驾，能够接受驻场工作形式。	全速网络	150-500人	移动互联网,电商	未融资	五险一金|双休|13薪|年度体检
