200	工艺工程师	https://www.lagou.com/jobs/6851020.html	品控专员	电商|审核|质量认证|品控|资质认证	15k-20k	全职	杭州	余杭区	文一西路恒生科技园3号楼	大专及以上	1-3年	2020-03-27	岗位职责：1.不断地建立和完善品控质检标准，并确保在商家入驻前的全量寄样质检和商家正常售卖过程中的质量抽检后的有效执行；2.对于待检测商品进行质检，站在消费者的角度去发现存在的商品质量问题，并提交报告，并能给出商家整改建议；3.协同各兄弟部门对社群反馈的质量事故进行问题场景还原和分析，并对售后问题及时反馈总结，提出改善建议；4.负责品控质检团队的建设和日常管理。任职资格：1、熟悉服饰&食品&美妆行业相关知识，对互联网产品有认知；2、1年及以上商品品质管理相关经验，有互联网经历优先；3、具备一定的规则意识、风险意识，较好的逻辑思维能力及一定数据分析能力。4、熟练使用EXCEL并能进行数据图表的制作分析5、为人正直，个性严谨、皮实，责任感强。6、具备有良好的沟通协调能力、学习能力。7、有服装质检品控经验者优先；熟悉服装工艺要求和质量标准，并掌握质量检验的方法和技术者优先；	鲸灵集团	150-500人	消费生活	C轮	五险一金|准独角兽企业
201	工艺工程师	https://www.lagou.com/jobs/6313969.html	资深工业设计师/主管	工业设计|3D	15k-25k	全职	上海	闵行区	田林路1016号科技绿洲三期10号楼（葡萄科技）	本科及以上	3-5年	2020-03-27	岗位职责：1、积木体系设计：运用设计思维，通过调查、研究、测试等手段发现积木体系的创新机会。与产品经理沟通，了解产品对积木零件新的需求并通过调查、研究、测试来判断新需求的合理性；2、积木搭建体系设计：积木搭建规则、步骤的研究、梳理，协助搭建体系设计师完成搭建规则的确立；3、设计执行：独自承担设计执行的工作，通过独立思考与团队协作沟通，完成产品的研究、开发、生产等一系列产品开发流程（产品调研、概念设计、3d模型、mockup、设计优化、工厂生产质量跟进等）。岗位要求：1、3-5年工业设计经验，出色的审美观、设计整体和对细节追求的平衡能力，很强的创新意识、逻辑思维能力，设计思路清晰。有独立思考与团队协作沟通的能力；2、喜爱儿童产品设计，喜欢追逐热点，爱好广泛，钻研儿童相关或最新的科技技术；3、对结构设计、产品加工工艺、成本控制具有一定了；4、熟练的产品概念表现手法，形式不限（2d、3d、手绘）软件熟练使用proe、rhino、PS、AI等设计软件。	Putao	500-2000人	移动互联网	未融资	公司平台好|发展前景大|职位晋升快
202	工艺工程师	https://www.lagou.com/jobs/6947605.html	项目专员/经理（测试，NPI)	通信/网络设备|智能硬件|项目管理|QA|风控|解决方案	8k-15k	全职	上海	长宁区	凯旋路369号雅仕大厦18层	本科及以上	3-5年	2020-03-27	职能:项目管理：负责硬件产品项目从研发到量产的项目管理跟进质量控制：结合产品制定研发阶段产品测试标准测试计划，全程跟进测试，推进bug解决生产外包跟进，制定量产产线测试标准新产品导入生产外包工厂管理要求：本科以上学历，有三年以上硬件产品测试或者新产品导入经验熟悉音箱，NAS，路由等软硬件测试标准优先，熟悉3C等相关认证测试标准，有新产品导入生产经验，熟悉工厂，SMT，组装工艺等有研发项目管理经验优先英语熟练优先	碳承数据	少于15人	医疗丨健康,数据服务	天使轮	发展前景广阔
203	工艺工程师	https://www.lagou.com/jobs/6856425.html	视觉设计师（驻场滴滴）	广告营销|移动互联网|视觉|用户体验|创意|插画	8k-12k	全职	杭州	西湖区	西溪谷国际商务中心	大专及以上	1-3年	2020-03-27	工作内容：1、参与大型整合营销设计2、线上营销页面、玩法3、线下活动策划及物料设计4、相关视频及平面素材拍摄、跟进岗位要求：1、至少2年以上广告/互联网/设计公司相关工作经验2、具有一定交互及产品思维，能够兼顾视觉表现及业务诉求2、具备线下活动策划能力、对印刷工艺有较深入了解优先3、善于沟通协作，有良好的工作态度和持续的学习能力4、岗位属于驻场滴滴代驾，能够接受驻场工作形式	全速网络	150-500人	移动互联网,电商	未融资	公司氛围好|年度旅游|年度体检。
204	工艺工程师	https://www.lagou.com/jobs/6858440.html	家具品类产品经理	电商	10k-20k	全职	北京	朝阳区	将台路5号院内16号楼（普天实业科技园16号楼）	本科及以上	3-5年	2020-03-27	您的工作职责：1.负责自营家具品牌产品线从产品定位，产品开发到产品上线销售端到端的全流程工作；2.负责板材类、原木类家具的主要制造工艺、五金件辅料等的选型与成本平衡；3.负责软体家具的设计要点、沙发填充选型与成本平衡；4.负责将设计想法与工厂沟通并且具备将设计想法落地的能力；5.懂得提炼用户易于理解的产品卖点；6.负责家具产品线规划及定价管理；负责制定组合销售定价策略；7.基于使用场景出发为商品关联销售做设定；基于家具不同产品线特点设计软装搭配；8.负责月度供应商对账与结算管理；您需要具备的能力与特质：1、统招本科及以上学历；家具设计、室内设计等相关专业优先；2、热爱家居类产品；热爱家具行业，室内设计行业；3、家具设计、室内设计等相关专业优先；4、熟悉AutoCAD、AI、PS；5、熟悉SketchUp；	自如网	2000人以上	房产家居	A轮	上升快|牛人多|工作有趣|领导好
205	工艺工程师	https://www.lagou.com/jobs/6658544.html	IP衍生品设计师	教育	10k-20k	全职	北京	朝阳区	启明国际大厦B座	本科及以上	3-5年	2020-03-26	职位详情：1.负责根据公司IP的调性和风格，延展衍生周边产品设计及包装设计2.可独立完成产品设计工作，可与厂家进行沟通参与样品的进程与跟踪3.商城产品产品详情页的设计和美化4.能够结合行业发展和动态及趋势，协助IP品牌设计升级5.能主动参与产品周边产品选品工作，提出可实施行的意见方案任职要求：1.本科以上学历。设计类相关专业，有三年以上衍生品或平面设计经验2.熟练掌握Photoshop、IIIustrator等主流设计软件，掌握3D软件者优先考虑3.熟悉衍生品常见的品类和材质工艺，有良好的沟通能力，能充分表达设计理念4.有较高的审美能力，优秀的手绘能力，基础功扎实，综合能力强5.团队合作精神，责任心强，善于沟通，有一定的抗压能力加分：有文创或动漫衍生品领域设计者优先，关注和喜欢潮流玩具等IP衍生品优先	火花思维	2000人以上	移动互联网,教育	D轮及以上	七险一金
206	工艺工程师	https://www.lagou.com/jobs/6400471.html	结构工程师	招聘	10k-15k	全职	珠海	香洲区	银桦路102号	本科及以上	3-5年	2020-03-27	任职条件1.本科以上学历，机械设计类相关专业；2.具备3年以上结构设计经验；3.熟悉机械产品设计流程，通晓机械加工工艺；4.精通Pro/E、Solidworks、AutoCAD、OFFICE等设计软件及办公软件；5.有较强的团队工作意识，独立工作能力强。岗位职责1.负责产品结构研发工作；2.参与结构设计规范、标准、文档模板等的制订、维护，并贯彻遵循硬件、产品的标准要求，保证开发过程的标准化。3.根据要求参加项目研讨，对产品设计方案和阶段计划提出合理化建议。	珠海优特科技集团	500-2000人	其他	不需要融资	双休|科技型企业
207	工艺工程师	https://www.lagou.com/jobs/6846016.html	工业设计师	移动互联网	15k-30k	全职	深圳	南山区	南海大道2163号来福士广场15层	本科及以上	3-5年	2020-03-26	职位职责：1、产品外观设计，将企业规划，产品定位和品牌要素物化为有竞争力的工业设计。2、独立主导项目，全流程参与研发和量产，将好设计转化为好产品出众的造型能力，游刃有余的设计表达。熟练掌握手绘，电脑建模及快速渲染。3、对材质、工艺、表面处理有丰富经验与敏锐感受，能够结合设计趋势，做到突破与创新。职位要求：1、理解并具备与工程师协作的能力与经验，在研发过程中能够以设计视角独立解决实际问题。2、对产品价值体系与塑造品牌有深刻认知，能通过自己的设计触及到项目的产品层面与品牌层面。3、同理心与团队协作能力，能以用户/消费者为中心构建自己的设计思维与价值判断体系，具备职业设计师团队协作创新的能力与认知。4、3年以上消费类电子产品工业设计工作经验。	字节跳动	2000人以上	文娱丨内容	C轮	六险一金|弹性工作|餐补|租房补贴
208	工艺工程师	https://www.lagou.com/jobs/6416145.html	硬件工程师	硬件开发|电路设计|PCB设计	8k-13k	全职	成都	高新区	天府五街菁蓉国际广场	硕士及以上	应届毕业生	2020-03-27	岗位职责：1.负责成品需求分解及方案设计；2.负责成品硬件设计，测试大纲编写并完成硬件测试；3.负责成品生产交付相关文档编写工作；4.负责成品EMC，ESS等相关试验及整改；5.负责硬件故障排查及整改。岗位要求：1.熟练掌握模拟电子技术及数字电子技术；2.了解各类总线电气协议标准；3.了解常用电子元器件性能参数及使用方法；4.熟悉常用测试仪器及工具的使用及维护方法；5.熟悉常用电子元器件失效模式；6.了解常见PCB及PCBA生产工艺；7.熟悉常规硬件CAD软件的使用；8.熟悉硬件设计的EMC及信号完整性相关知识；9.了解常用机械加工工艺，能在设计中充分考虑机械结构问题。10.电子及相关专业本科或以上学历。优秀者条件可放宽，欢迎广大应届生投递简历.	傲势科技	150-500人	其他	A轮	环境好|节假日福利|领导nice
209	工艺工程师	https://www.lagou.com/jobs/6921758.html	美指/资深美指	广告营销	10k-15k	全职	广州	海珠区	琶洲大道８３号宝地广场３Ｆ	大专及以上	3-5年	2020-03-27	岗位职责：1、理解广告策略，并激发创意，带领组员进行创意的发想；2、领导创作小组完成项目，对出品进行美术上的指导，负责监控出品的品质；3、不仅能够用图形、而且善于用语言和文字表达思想。职位要求：1、广告、美术、设计、绘画等专业出身，有精致的美感表达；2、3年以上外商广告公司工作经验，4A广告公司经验者优先；3、对策略有基本理解和创意思考；4、精通MAC操作，熟练掌握Illustrator、Photoshop、Freehand、AI等设计软件，对相关印刷工艺有一定的理解。	E-linkCreative	50-150人	移动互联网,广告营销	不需要融资	团队氛围好|专业培训|五险一金
210	工艺工程师	https://www.lagou.com/jobs/6062430.html	设计实习生G00265	UI|平面	2k-4k	实习	深圳	宝安区	深圳市宝安区海秀路龙光世纪大厦A座6层	本科及以上	应届毕业生	2020-03-27	岗位职责：1.参与Insta360的品牌系统建设、品牌规范的维护；2.产品市场与销售活动中广告创意的执行，包装、传单、手册、展位等平面印刷品的设计工作；社交平台配图、H5等电子宣传品的设计工作；3.手机AppUI、网页UI、产品机身UI的设计制作。岗位要求：1.本科及以上，艺术类院校的美术、设计、视觉传达相关专业优先。2.积极主动、善于沟通，热爱设计行业。3.把握最新设计趋势与潮流，通晓基本设计理论，熟练掌握设计工具。4.加分项：手绘功底好、会用Sketch、熟悉印前及印刷工艺、有硬件数码类广告项目经验、有3D渲染经验5.一周至少到岗3天，需连续实习3个月以上，请将近期作品或者作品展示链接附在简历后	Insta360影石	150-500人	硬件,移动互联网	D轮及以上	产品潜力大|团队氛围好
211	工艺工程师	https://www.lagou.com/jobs/5625383.html	资深包装设计	创意|包装|品牌	10k-12k	全职	广州	荔湾区	芳村大道中311号启秀茶城E栋	大专及以上	3-5年	2020-03-27	岗位职责：1、负责产品包装及海报、微信、公众号等各类视觉新媒体的宣传设计；2、根据各品牌产品定位，负责各品牌产品包装的整体风格设计与把控，独立负责产品内外包装设计；3、熟悉VI设计，了解包装设计的定位，根据领导提出的要求提供包装方案，提供相应的包材和工艺建议；4、独立完成包装设计印刷稿；5、收集行业标准、各种相关产品的详细资料、较强的市场分析能力。任职要求：1、专科以上学历，有相关工作经验；2、艺术设计、视觉传达及美术等相关专业；3、3-4年及以上精品包装设计经验（如月饼、茶叶、酒等）；4、Photoshop、CorelDRAW、Illustrator等设计软件，掌握3dsMax、犀牛、CAD、C4D等部分三维软件基础。注：投递简历时请附上个人作品！	义统包装	150-500人	其他	未融资	包吃住|五险一金|年终奖|晋升空间大
212	工艺工程师	https://www.lagou.com/jobs/6767449.html	项目经理（水务行业）	项目管理|成本管理|实施	8k-12k	全职	杭州	滨江区	浙江杭州滨江区滨康路352号中控信息大楼A座	本科及以上	3-5年	2020-03-27	1、负责水务项目管理工作，包括项目立项、需求分析、项目实施、项目验收等；2、负责项目实施过程中的相关其他工作；3、完成项目验收及回款等工作。任职要求：1、自动化、机电、环境工程等相关专业，本科及以上学历；2、3年以上机电工程项目管理工作经验，熟悉信息化、自动化工程实施（有水利、水务行业项目实施经验者优先）；3、熟悉工程项目管理知识，熟悉系统集成各子系统相关知识；4、工作主动性强，适应长期出差；5、熟悉净水污水处理厂工艺者优先。	浙大中控信息	500-2000人	数据服务,硬件	不需要融资	弹性工作|福利待遇好|工作氛围好
213	工艺工程师	https://www.lagou.com/jobs/6327188.html	工业设计师（industrial des...	移动互联网	20k-40k	全职	北京	海淀区	北三环西路43号中航广场1号楼（矮楼）	本科及以上	不限	2020-03-26	职位职责：1、产品外观设计，将企业规划，产品定位和品牌要素物化为有竞争力的工业设计；2、独立主导项目，全流程参与研发与量产，将好设计转化为好产品出众的造型能力，游刃有余的设计表达，熟练掌握手绘，电脑建模及快速渲染；3、对材质，工艺，表面处理有丰富经验与敏锐感受，能够结合设计趋势，做到突破与创新。职位要求：1、理解并具备与工程师协作的能力与经验，在研发过程中能够以设计视角独立解决实际问题；2、对产品价值体系与塑造品牌有深刻的认知，能通过自己的设计触及到项目的产品层面与品牌层面；3、同理心与团队协作能力，能以用户/消费者为中心构建自己的设计思维与价值判断体系，具备职业设计师团队协作创新的能力与认知；4、3年以上消费类电子产品工业设计工作经验。	字节跳动	2000人以上	文娱丨内容	C轮	六险一金|弹性工作|餐补|租房补贴
214	工艺工程师	https://www.lagou.com/jobs/6710800.html	包装设计师	包装设计	10k-15k	全职	上海	黄浦区	黄浦区淮海中路918号久事复兴大厦21楼E座	本科及以上	3-5年	2020-03-27	工作职责：1、对公司旗下化妆品类产品的内包装、外包装、产品套装礼盒进行设计；2、研究和分析竞品的内外包装，洞悉设计趋势并发展品牌差异化设计；3、根据上级和顾客意见建议，调整升级老品包装；4、把控品牌调性和风格，发展品牌主视觉。任职要求：1、美术设计类专业，本科及以上学历；2、具有3以化妆品行业或广告公司相关工作经验；3、熟练操作Photoshop、AI等设计相关软件，熟悉化妆品包装工艺；4、设计创意能力强、具有敏税的视觉把握能力，审美能力，色彩搭配能力；5、对时尚、化妆品有浓厚兴趣；6、具备良好的团队合作精神，能承受工作压力。	烙色彩妆	50-150人	电商,消费生活	不需要融资	化妆品或美妆包装设计经验|两年以上
215	工艺工程师	https://www.lagou.com/jobs/6804548.html	高级平面设计师	电商|广告营销|平面	6k-12k	全职	杭州	余杭区	文一西路998号海创园9幢	本科及以上	1-3年	2020-03-26	岗位要求：1、品牌创意设计和品牌营销设计2、根据项目的特征及要求，完成具体的平面视觉设计工作，并把控设计作品的质量和时间进度，满足项目进程3、给出创意发想，并在设计实施阶段提供有价值的建议岗位职责：1、有2年以上的品牌设计经验；对品牌设计有较强的灵感与创意，能独立完成高品质且系统化的品牌设计方案2、具备优秀的视觉表达能力，丰富的想象力和创造力，尤其是品牌/平面设计/电商营销视觉等相关的基础审美及技能，有手绘能力者加分3、能够熟练地使用平面、动效等常用设计工具4、对品牌设计以及趋势有敏锐嗅觉和前瞻性5、熟悉常见的制作工艺、印刷流程等、能够确保各类线下物料完美落地6、良好的沟通、团队协作能力。有高度的责任心，能高质、高效完成工作任务	多准大数据	150-500人	数据服务,广告营销	A轮	六险一金|旅游|带薪年假|培训发展|双休
216	工艺工程师	https://www.lagou.com/jobs/6929735.html	结构设计师	工业设计|结构设计|模具设计|机械	7k-14k	全职	深圳	南山区	TCL国际E城G4栋	本科及以上	3-5年	2020-03-27	1.机械类专业本科及以上；2.3年以上产品结构设计经验，了解产品机构特点及相关应用技术；3.2年以上塑胶，五金产品跟模经验，熟悉各类塑胶，五金产品模具结构及改模方法，熟悉产品开发机加工工艺及流程；4.熟练使用AutoCAD,Pro-e,UG等工程软件；5.勇于开拓创新，责任心强，良好的团队协作能力；6.具备良好的语言沟通能力。	四六区设计	少于15人	不限	未融资	大小周
217	工艺工程师	https://www.lagou.com/jobs/6907678.html	测试工程师	移动互联网|电商|功能测试|性能测试|产品测试|客户端	20k-30k	全职	深圳	南山区	科技园	大专及以上	不限	2020-03-27	工作职责：1、参与软件需求分析,确定测试范围。根据产品需求和设计文档,制定测试计划和测试方案,撰写相关文档,设计测试流程,评估项目风险。2、完整记录测试结果,撰写测试报告,完成测试结果分析,编写自动测试脚本。3、根据产品测试需求完成测试环境的设计与配置工作,负责测试环境的搭建和维护。4、负责单元测试、功能测试、性能测试、系统测试、验收测试以及BUG管理。5、对测试中发现的问题进行详细分析和准确定位,与开发人员讨论缺陷解决方案。6、负责研发转产的跟踪,包括小批量试制、工艺文件设计、生产环节的质量把控。任职要求:1、专科及以上学历,计算机、通信或电气类相关专业。2、熟悉C#/C/C++编程,有一定软件开发经验和能力。3、熟悉单元测试、集成测试、功能测试、系统测试、验收测试的方法和工作流程。4、必要时能够编写自动测试脚本执行自动测试。5、善于学习及解决问题,优秀的沟通能力,有责任心和团队精神。6、熟练使用MySQL、Oracle、SQLServer等数据库,B/S、C/S程序C#.net环境测试。7、熟悉常用的自动化测试工具,有自动化测试工作经验者优先。8、熟悉常用的性能测试工具,有性能测试工作经验者优先。9、至少5年以上软件测试工作经验。10、有良好的执行能力,能够主动积极地完成安排工作。	北纬三十度	150-500人	电商,医疗丨健康	未融资	大平台|福利好|发展前景好
218	工艺工程师	https://www.lagou.com/jobs/6916507.html	产品开发副经理/经理	其他	12k-18k	全职	广州	天河区	珠江新城华夏路13号南岳大厦22楼（珠江新城地铁上盖）	大专及以上	5-10年	2020-03-27	岗位职责：1、研究消费者需求，拟定产品发展策略，做好产品规划，制定产品开发主题、产品款式，开发适合品牌定位及市场需求的产品；2、制定产品开发计划，统筹产品开发过程，全面监控产品开发质量、控制成本，确保产品按计划上市；3、负责产品生命周期管理，跟进、评估产品发展状况，分析产品优劣，快速反馈与应变，确保产品力不断精进，满足消费者需求；4、负责与OEM供应商沟通，开展对新原料、新工艺的配方应用，提出降本增效方案，控制产品开发成本；5、负责产品生产加工流程把控，对产品结构、工艺流程等提出建议，及时协调、处理生产过程中存在的技术问题；6、对新品开发全程负责，包括产品的策划、文案、配方、包材选择、包装设计、产品定价等；7、贴近市场，完成对同类产品的市场动态和技术发展动向等情报的收集及分析。8、负责部门日常管理以及团队建设工作，并完成上级交办的其它工作。任职要求：1、大专或以上学历，5年以上日化、化妆品行业产品管理经验，有大中型知名日化或化妆品企业工作经验者优先；2、具备较强的护肤、日化市场分析能力，了解市场动态及趋势，并对行业发展方向有较深认识和见解；3、熟悉产品开发全过程，熟悉日化、化妆品行业的包装材料及创作工艺，对OEM厂运作流程有一定了解；4、具有优秀的敏锐的市场变化洞察能力、富有创新思维及独立开发新产品的能力；5、具备优秀的领导能力、统筹规划能力、沟通协调能力、团队合作意识及抗压能力。	广东天美联盟日化科技有限公司	500-2000人	消费生活	B轮	五险一金|周末双休|年底双薪
219	工艺工程师	https://www.lagou.com/jobs/6932266.html	NPI工程师	通信/网络设备	18k-30k	全职	北京	朝阳区	官庄路迈外迪办公楼2-4层	本科及以上	3-5年	2020-03-27	岗位职责：1、在产品初级阶段参与共同设计和设计评审，保障产品的可制造性和可靠性设计；2、负责新产品导入时，材料选择/结构/工艺/品质问题的发掘、评估和改善跟进，以及辅助工装、夹具的需求评估;3、负责产品生产方案的设计与落地,主导新产品的试产过程，组织召开《试产前准备会》和《试产总结会》，以及量产准入评审；4、组织新产品设计验证及制造系统验证活动，确保产品快速成熟量产；5、负责样机与试产阶段产品异常问题推动与改善；6、为工厂提供技术支持，协助工厂提高技术能力，提高量产产品的质量、生产效率和良率；7、研发BOM与样机实物的核对，负责产品BOM的制订及存档，并导入生产BOM；8、制作新品导入相关SOP，主导产品试产到量产转化衔接工作及流程标准化；8、制定工时定额及材料定额；9、领导交办的其他任务。任职资格：1、3年以上硬件产品导入经验2、熟悉硬件产品开发和量产流程，能够主导设计和规划测试方案。3、熟悉至少一种绘图软件，熟悉PCBA生产制程，精通SMT以及组装等相关生产工艺。4、熟悉常用电子器件,Flash，液晶屏，锂电池，传感器，了解ARM，,蓝牙,GPS芯片等。5、有消费或商业电子电器产品量产经验，可优先考虑。	迈外迪	150-500人	移动互联网,消费生活	D轮及以上	网络通信产品|物联网|网络协议
