301	工艺工程师	https://www.lagou.com/jobs/6269804.html	电商设计师	电商|视觉|品牌|平面	8k-12k	全职	广州	天河区	保利克洛维中景B座14层	大专及以上	1-3年	2020-03-27	岗位职责：1.能充分理解产品的调性和特点，并能准确地转换为平面设计图；2.主要负责日常线下物料设计（展架、画册、宣传单等）3.协助公司主流电商平台美工设计，如推广页、详情页面优化；4.协助公司各产品图片系列和详情系列的处理、优化及更新等；任职要求：1、美术设计类、及相关专业，本科及以上学历；2、有2年以上从事设计经验，有化妆品相关设计经验优先，具有较好的审美能力；3、精通Photoshop、AI、等设计软件，熟悉使用C4D软件者优先考虑；4、熟悉印刷流程、工艺知识以及实践经验；3、具有较强的学习能力，具备良好的表达能力，思维清晰，执行力强。	德薇VELLAVETA	2000人以上	电商,消费生活	上市公司	五险一金|员工旅游|绩效奖金|年终奖金
302	工艺工程师	https://www.lagou.com/jobs/5213103.html	PHP工程师	电商	10k-16k	全职	上海	杨浦区	世界路133号A座3楼	大专及以上	1-3年	2020-03-27	职位描述（工作内容和主要职责）：1、负责企业平台系统开发的设计、编程、调试、运行、维护等工作；2、编写开发文档，以及协助解决各种技术问题；3、进行详细设计、代码开发、配合测试完成项目；4、按照项目计划，按时提交高质量代码，完成开发任务。任职要求：1、1年以上PHP开发经验；2、熟悉PHP开发,熟悉ci,yii,laravel,thinkPHP等一个或以上常用框架，熟悉面向对象技术、MVC模式；3、熟悉Mysql数据库技术和memcached,redis等；3、熟悉Linux下Nginx/Apache、PHP、MYSQL各种配置，能够在Linux环境下开发；4、熟悉基本的HTML/CSS/JS/jQuery/AJAX等前端相关知识和svn,git等版本控制工具；6、具有良好的沟通、理解及逻辑分析能力，思维敏捷、编程及学习能力强，有责任心。1979年创立的上海城建物资有限公司是国资委下以商品混凝土、预制构件、新型建材科研开发、生产销售为主业的国有独资企业，具有高新技术企业称号。是获得日本PC协会认证资质的混凝土预制构件企业。多次参与了上海市标志性工程和重大工程项目建设。承揽了上海轨道交通、源深体育中心、延安路高架工程、浦东机场、虹桥交通枢纽工程、世博中国馆及世博园区、陆家嘴金融贸易区、外滩通道、中环线抢修等重点工程。“十三五”期间，城建物资进一步明确了“绿色产业”发展的目标，从生产制造型企业向生产服务性企业转型，积极发展服务型制造和生产性服务，加速转型发展，成为新材料综合服务商。2015年城建物资投资成立绿色建筑供应链集成服务平台——“绿智汇”（汇绿公司）（www.igreenbuy.com），集展示、交易、认证、推广、交流及相关配套服务为一体的O2O供应链电商平台。“绿智汇”平台通过线上线下相结合的方式为绿色建材相关企业提供品牌、产品、技术、工艺等方面的线上展示，并结合线下孵化器、线下展厅、新品推荐会、技术研讨、专业论坛等活动来促进绿色建材产品交易与推广应用。为绿色产业链上的企业提供绿色建材标识认证、专业咨询、商务办公、生产厂房、配套物流、金融服务、产业孵化基金等一站式产业配套专业服务。目前，“绿智汇”电商平台分为四大业务范围，分别是：绿色建材、绿色建筑、绿色能源和循环经济四大业务的线上线下的展示、交易及配套服务。产品分别是：采购平台、新材料大数据中心、智推宝（市场推广）、zhaopc（装配式）、智能健康快装、交易结算中心、技术营销中心。经过几年的沉淀与积累，绿智汇将进行混改，在业务上不断升级。福利待遇:1、私人定制的薪资结构，领先于业内水平；2、年终奖金、绩效奖金、还有与你的能力和表现对应的项目奖金等；3、价值体现的调薪机制，个性化的职业发展通道；4、为每位员工缴纳（五险三金）养老保险、医疗保险、失业保险、工伤保险、生育保险、企业年金、补充公积金。来吧！加入“绿智汇”让我们一起任性！公司主页：www.shmgc.com“绿智汇”平台：www.igrenbuy.com绿智汇公众号：绿智汇	绿智汇	50-150人	电商,消费生活	A轮	高绩效|高项目奖金|企业年金|补充公积金
303	工艺工程师	https://www.lagou.com/jobs/5213086.html	JAVA开发工程师	电商	10k-15k	全职	上海	杨浦区	世界路133号A座3楼	本科及以上	3-5年	2020-03-27	岗位描述1、负责所属模块的功能规划、需求分析设计、技术实现和用户体验提升；2、负责所属模块的代码开发、调试与维护工作；3、参与公司系统的架构优化，性能优化并辅助其他模块进行技术实现；4、协助并完成其他各类技术开发任务。任职要求1、计算机或者相关专业，统招全日制本科及以上学历。2、良好的问题理解能力，能够理解以及处理复杂逻辑。3、2年以上java及WEB应用软件开发经验，熟知软件开发流程；4、熟练应用Spring,SpringMVC,SpringBoot,Mybatis框架，理解其运作原理；5、熟练使用各种缓存工具，如memcache、redis、mongodb等；6、了解或熟悉一种或多种消息框架，如rabbitmq、kafkamq、activemq、rocketmq；7、熟悉Linux下Nginx/Apache、MYSQL各种配置和调优，能够在Linux环境下开发，掌握各种调优技巧；8、熟悉基本的HTML/CSS/JS/jQuery/AJAX等前端相关知识和svn,git等版本控制工具；9、有高并发、高负载、高可用，分布式、集群系统开发经验优先。1979年创立的上海城建物资有限公司是国资委下以商品混凝土、预制构件、新型建材科研开发、生产销售为主业的国有独资企业，具有高新技术企业称号。是获得日本PC协会认证资质的混凝土预制构件企业。多次参与了上海市标志性工程和重大工程项目建设。承揽了上海轨道交通、源深体育中心、延安路高架工程、浦东机场、虹桥交通枢纽工程、世博中国馆及世博园区、陆家嘴金融贸易区、外滩通道、中环线抢修等重点工程。“十三五”期间，城建物资进一步明确了“绿色产业”发展的目标，从生产制造型企业向生产服务性企业转型，积极发展服务型制造和生产性服务，加速转型发展，成为新材料综合服务商。2015年城建物资投资成立绿色建筑供应链集成服务平台——“绿智汇”（汇绿公司）（www.igreenbuy.com），集展示、交易、认证、推广、交流及相关配套服务为一体的O2O供应链电商平台。“绿智汇”平台通过线上线下相结合的方式为绿色建材相关企业提供品牌、产品、技术、工艺等方面的线上展示，并结合线下孵化器、线下展厅、新品推荐会、技术研讨、专业论坛等活动来促进绿色建材产品交易与推广应用。为绿色产业链上的企业提供绿色建材标识认证、专业咨询、商务办公、生产厂房、配套物流、金融服务、产业孵化基金等一站式产业配套专业服务。目前，“绿智汇”电商平台分为四大业务范围，分别是：绿色建材、绿色建筑、绿色能源和循环经济四大业务的线上线下的展示、交易及配套服务。产品分别是：采购平台、新材料大数据中心、智推宝（市场推广）、zhaopc（装配式）、智能健康快装、交易结算中心、技术营销中心。经过几年的沉淀与积累，绿智汇将进行混改，在业务上不断升级。福利待遇:1、私人定制的薪资结构，领先于业内水平；2、年终奖金、绩效奖金、还有与你的能力和表现对应的项目奖金等；3、价值体现的调薪机制，个性化的职业发展通道；4、为每位员工缴纳（五险三金）养老保险、医疗保险、失业保险、工伤保险、生育保险、企业年金、补充公积金。来吧！加入“绿智汇”让我们一起任性！公司主页：www.shmgc.com“绿智汇”平台：www.igrenbuy.com绿智汇公众号：绿智汇	绿智汇	50-150人	电商,消费生活	A轮	高绩效|高项目奖金|企业年金|补充公积金
304	工艺工程师	https://www.lagou.com/jobs/6468154.html	机械结构工程师	硬件制造	8k-16k	全职	杭州	滨江区	滨江区六和路307号六和大厦E座九楼	大专及以上	3-5年	2020-03-27	岗位职责：1.负责公司产品的结构方案设计、设计图和生产加工图的图纸绘制；2.负责产品结构的设计、改进、优化，以及材料选型等工作;3.编写设计方案文档、设计文档、加工生产作业指导文档等，整理和归档相关明细和装配图纸；4.负责产品结构件的选型、验证、验收，参与购买和加工合同的制定；5.跟进结构件加工进度、质量情况，与供应商协调沟通结构和工艺问题，参与样机装配并及时处理设计、加工、装配过程中出现的问题，不断完善产品结构设计；6.对安装调试、品管、售后等环节提供操作培训和技术支持；任职要求：1.大专及以上学历，机械、机电一体化及相关专业。2.熟悉安检机类仪器者优先；3.有较强的逻辑思维能力问题分析解决能力。	啄云智能	50-150人	人工智能	未融资	周末双休|五险一金|带薪年假|免费零食
305	工艺工程师	https://www.lagou.com/jobs/5317275.html	乳化工	其他	4k-6k	全职	广州	白云区	太和镇大沥村第四经济合作社西街自编18号	大专及以上	3-5年	2020-03-27	任职要求：岗位职责：1、按照上级要求，按时按量完成当天的生产任务；2、主要负责化妆品的配料、乳化等工作。3、能够按照正确的工艺要求进行生产操作，具备乳化设备操作能力对乳化生产机器有一定的了解；4、定时做好乳化车间卫生整理工作，定时对机器设备保养、维护操作工作，保证产品品质。任职资格：1、学历不限，有化妆品工厂1-2年以上的的生产乳化作业经验；2、服从管理，责任心强，不浮躁，有团队精神，服从领导安排；3、对乳化锅及制水机制作设备有一定的了解，能单独操作生产设备，能独立完成任务。4、条件优秀者可培养为主管公司产品：全系列护肤品化妆品oem爽肤水、乳液、膏霜、面膜、洗面奶、BB霜、护肤品等。	芸阳	15-50人	移动互联网,电商	未融资	前景无限|自身镀金的绝好机会和平台
306	工艺工程师	https://www.lagou.com/jobs/6942472.html	ID设计师	工业设计	10k-18k	全职	深圳	宝安区	西乡固戍航空路与顺昌路交汇处,梧桐岛,立春5楼	本科及以上	1-3年	2020-03-27	岗位职责：1、负责公司产品的造型与外形设计（设计调研、草图创意、2D、3D、外观手版跟踪、产品设计的造型跟踪，后期工艺和配色）；2、根据电子烟市场流行元素结合公司品牌和市场要求来不断优化设计并最终提供可行的设计和外形渲染图，同时清晰表达和诠释产品特色和卖点；3、主导ID及CMF设计评审，协调解决有关结构，模具，装配和表面处理问题并按时输出设计和锁定IDsurface.；4、建立设计素材库和CMF标准样板，文件归档。任职资格：1，大专以上学历，工业设计，美术或艺术设计等相关专业，有4年以上电子烟、数码电子产品ID设计工作经验；2、热爱电子产品设计，有创意，有灵感，能掌握流行趋势，对造型、色彩、工艺、表面处理有充分的感知和把握能力；3、熟练运用工业设计软件：Rhino（精）/Pro-E/3DMAX/KeyShot/Coreldraw等；4、对结构、工艺、材料（塑胶五金）等有一定了解，擅长草图手绘，并能用草图清楚表现具体设计细节；5、性格开朗，思维活跃，强烈的责任心、上进心，工作主动积极，有团队协作精神，具有良好沟通能力，能承受工作压力；6、细心负责，工作效率高。温馨提示：投递简历时请附上个人作品链接	亿乐谷	150-500人	电商	D轮及以上	五险一金|晋升空间|舒适的环境
307	工艺工程师	https://www.lagou.com/jobs/6919343.html	平面设计师	可穿戴设备|智能硬件|平面|平面设计	10k-20k	全职	深圳	南山区	深南大道9676号大冲商务中心C栋28层 	本科及以上	3-5年	2020-03-26	岗位职责：1、负责公司的新品平面物料设计，包括但不限于产品折页，宣传册，单页，易拉宝，海报等设计；2、参与公司展会的展示设计方案，对设计方案提出问题并提供解决方案；3、支持海外市场的其他设计需求。任职要求：1、具备较好的版式设计能力；2、熟悉平面印刷工艺，制作文件规范，平面类设计软件，Photoshop，illustrator。有三维表现能力更佳；3、对展示设计（展会，线下店陈列）的设计，工艺，材料有一定了解；4、有一定英语基础优先；5、本科以上学历，艺术设计类，计算机类相关专业；6、投递简历时，请附带作品集或者链接。	华米科技	500-2000人	移动互联网	上市公司	六险一金|年终奖|加班补助|班车
308	工艺工程师	https://www.lagou.com/jobs/6929273.html	平面设计师（物料）	可穿戴设备|智能硬件|平面设计	12k-24k	全职	深圳	南山区	深南大道9676号大冲商务中心C栋28层 	本科及以上	1-3年	2020-03-26	岗位职责：1、负责公司的新品平面物料设计，包括但不限于产品折页，宣传册，单页，易拉宝，海报等设计；2、参与公司展会的展示设计方案，对设计方案提出问题并提供解决方案；3、支持海外市场的其他设计需求。任职要求：1、具备较好的版式设计能力；2、熟悉平面印刷工艺，制作文件规范，平面类设计软件，Photoshop，illustrator。有三维表现能力更佳；3、对展示设计（展会，线下店陈列）的设计，工艺，材料有一定了解；4、有一定英语基础优先；5、本科以上学历，艺术设计类，计算机类相关专业；6、投递简历时，请附带作品集或者链接。	华米科技	500-2000人	移动互联网	上市公司	六险一金|年终奖|加班补助|班车
309	工艺工程师	https://www.lagou.com/jobs/6069847.html	品质检验专员(J10020)	本地生活|品控	6k-12k	全职	深圳	宝安区	宝安区	大专及以上	1-3年	2020-03-26	工作职责:1、负责对供应商供货质量的统计及评价工作，监控供方持续改进，成品检验，并达到要求；；2、负责供应商的体系审核及生产流程审核；3、推进并监督供应商完善质量保障体系；4、负责供应商的质量辅导及项目扶持；5、负责公司产品质量整体情况的汇总、统计、分析，并对产品解决方案进行落实，跟踪效果；6.负责对供应商品质状况进行管理；7.负责对无法处理和协调问题进行及时反馈；任职资格:1、本科及以上学历，质量管理、机械、电子专业尤佳；2、熟悉生产线工位操作工艺及相关检验要求；3、具有良好的沟通协调、团队合作的能力和高度责任心，适应出差；4、熟悉ISO9000质量管理体系和质量相关QC七大工具应用；5、有2年及以上质量管理经验者优先。	小电	2000人以上	移动互联网,硬件	B轮	五险一金|周末双休|弹性工作|全员MAC
310	工艺工程师	https://www.lagou.com/jobs/6069082.html	品质检验专员(J10020)	智能硬件	7k-12k	全职	杭州	余杭区	海创园5幢704	大专及以上	1-3年	2020-03-26	工作职责:1、负责对供应商供货质量的统计及评价工作，监控供方持续改进，成品检验，并达到要求；；2、负责供应商的体系审核及生产流程审核；3、推进并监督供应商完善质量保障体系；4、负责供应商的质量辅导及项目扶持；5、负责公司产品质量整体情况的汇总、统计、分析，并对产品解决方案进行落实，跟踪效果；6.负责对供应商品质状况进行管理；7.负责对无法处理和协调问题进行及时反馈。任职资格:1、本科及以上学历，质量管理、机械、电子专业尤佳；2、熟悉生产线工位操作工艺及相关检验要求；3、具有良好的沟通协调、团队合作的能力和高度责任心，适应出差；4、熟悉ISO9000质量管理体系和质量相关QC七大工具应用；5、有2年及以上质量管理经验者优先。	小电	2000人以上	移动互联网,硬件	B轮	周末双休|五险一金|股票期权|全员Mac
311	工艺工程师	https://www.lagou.com/jobs/3237954.html	PLM售前顾问	医疗健康	10k-16k	全职	广州	天河区	翰景路1号金星大厦19-20楼	大专及以上	5-10年	2020-03-27	职位描述：1、负责支PLM项目的售前咨询工作（PLM产品调研，产品方案书撰写，解决方案讲解，产品演示等）；2、配合客户经理推进销售进程，并在不同阶段参与营销推进工作；3、完成售前阶段的客户调研、分析和产品的适应度客户化分析，降低项目销售和实施风险；4、完成应用数据的整理、售前应用方案的编写、讲解以及产品的演示，结合客户实际业务进行售前沟通；5、完成售前工作业绩，完善行业方案及产品规划、样板客户案例以及企业管理模式和业务模式的总结提炼；6、研究市场趋势、对同业产品进行分析学习任职要求：1、本科以上学历，5年以上工作经验，2年以上企业信息化工作及研发、设计、工艺、标准化等某一领域实务管理经验；2、熟练掌握主流CAD设计软件（1种或以上）；3、熟悉市场上主流的PDM/PLM系统；4、熟悉Oracle数据库管理维护；5、良好的沟通、表达能力，以及解决方案撰写和呈现能力；6、有过PDM/PLM系统实施、售前经验优先。加入公司，你可以享受到优厚的薪资福利待遇和完善的培训发展体系：-优厚的基本薪资、岗位技能、管理津贴、绩效奖金、年终奖、年度调薪-弹性工作时间、法定年假、福利年假、法定节假日、带薪病假-五险一金、商业保险（补充医疗保险、意外伤害保险）-午餐补贴、通讯补贴、自备机补贴、出差补贴-生日礼金、节假日福利、婚丧喜庆福利、定期体检-健全完善的培训体系-宽广的晋升发展平台更多鼎捷相关：http://www.digiwin.com.cn/yqh/Simple_dem/index.html	鼎捷软件	2000人以上	其他	上市公司	软件原厂商|上市公司|五天八小时|五险一金
312	工艺工程师	https://www.lagou.com/jobs/6753830.html	系统工程师	医疗健康|Linux	20k-30k	全职	北京	海淀区	知春路23号量子银座5层517	本科及以上	5-10年	2020-03-27	工作职责：1、负责在研仪器的设计优化、产品化工作；2、建立起系统性的仪器产品设计开发流程，协调仪器各专业的设计、开发、验证、改进及产品定型工作，包括整机结构布局，整机散热，控制系统设计，软硬件配合，管线设计等；3、负责仪器产品化流程的管理，推进需求分析，设计更改，生产质检，可靠性设计，设计规范等工作；4、负责产品设计过程中技术故障的定位、分析和解决，及时总结经验，优化系统设计方案，并进行设计修改和设计改进，完成产品定型工作；5、推进和协调仪器设计转产、生产、设计更改、召回升级、降成本、销售、维护等各阶段的系统设计问题，及时预警项目异常情况，并推动设计端的完善；6、负责仪器部团队管理工作，完成领导交办的其他工作。任职资格与要求：1、仪器相关专业本科以上学历（硕士优先），生物医学工程、电子工程、机械工程、医学影像等相关专业优先；2、有丰富的仪器系统设计经验，有医疗设备开发工作经验者优先考虑；3、具有扎实的一线设计、测试、工艺开发、维护工作经验；具备敏锐发现问题并系统性解决问题的能力；4、善于快速学习新东西，知识面广；思维缜密，细致，追求卓越的精神；有很强的动手能力和团队合作精神；主动性和执行力强，精力充沛；5、熟悉医疗器械相关法规标准（IEC60601，GB9706..）；6、熟练使用软件工具进行系统数据的统计及分析；7、熟悉系统/硬件/软件等相关设计。	优脑银河	15-50人	医疗丨健康、人工智能	天使轮	扁平管理|管理规范|发展空间大
313	工艺工程师	https://www.lagou.com/jobs/6876012.html	解决方案硬件支持经理(J10649)	单片机|嵌入式|智能硬件|模具设计	25k-30k	全职	广州	海珠区	海珠区琶洲大道东3号保利国际广场东馆3楼	硕士及以上	3-5年	2020-03-27	工作职责:1.负责嵌入式Linux工业物联网网关，单片机采集的硬件评估。产品主要涉及通讯，传感器采集和基于STM32系列单片机、ARM嵌入式Linux的控制系统。2.熟悉产品硬件设计方案，测试方案、工业网关选型；对于非标准定制方案，需按要求督导、实施供应商对于硬件解决方案落地实施，协作完成硬件设计，开发，调试及产品生产工艺指导。配合嵌入式、单片机软件驱动开发。3.负责硬件详细设计及实现，包含原理设计、PCBlayout、工艺规范、硬件调试，相关认证。制定并参与产品的调试、测试流程；编写产品技术说明书等配套文档。；负责与硬件生产加工方进行技术对接；负责对现有工业场景下硬件产品持续功能改进、降本、稳定性提升。4、负责物理学相关计算，强弱电电磁兼容设计等；负责硬件外壳的结构设计，材料辅助选取，实施安装定位；负责电路板安装外围壳体，安装结构件选取，模具订制工作。5、主管交代的其他工作。任职资格:1.4年以上相关开发工作经验。具备工业场景下智能硬件的产品经理能力。2.熟悉C/C++编程，精通模拟电路、数字电路，具有低功耗传感器采集相关设计经验，熟悉嵌入式设计；了解硬件电路的电磁干扰设计、分析方法；熟悉Multisim等电路仿真工具，熟练掌握Protel，AD等原理图与PCB设计工具；掌握AutoCAD/SolidWorks等结构设计软件至少一种。3.熟悉电子产品结构设计的要求和原则；熟悉硬件开发流程，设计文档、设计文件、生产治具、测试程序文件。具有很强的动手能力，可自行焊接调试电路，制作临时外壳；扎实的硬件设计功底，能够完成高速信号电路、多层板（4层/6层）的Layout。4.硕士学历、211、985高校优先，有工控硬件设计经验、电气控制柜设计经验优写。	树根互联技术有限公司	150-500人	移动互联网,企业服务	A轮	工业互联网风口|奖金丰厚|扁平化管理
314	工艺工程师	https://www.lagou.com/jobs/6909964.html	结构设计专家-车身(J191226...	滴滴	20k-30k	全职	北京	海淀区	北京市海淀区东北旺西路8号数字山谷	本科及以上	5-10年	2020-03-26	岗位职责1.负责产品结构设计；2.根据设计效果图和3D文件，结合提供的内部电子元器件，进行PCB板的堆叠和外壳结构设计；3.与设计师和电子工程师进行技术沟通，完成设计到制造的衔接。岗位要求：1.机械/设计专业专科或以上学历；2.五年以上交通工具类产品结构设计经验，能独立完成结构设计项目；3.熟悉产品开发流程、制造工艺、以及由设计到制造的对接；4.熟悉塑胶，五金等材料的结构设计特征以及加工工艺材料的运用；5.精通AutoCAD,Solidworks,或Pro-E等软件；6.踏实认真，有责任心，具有良好的沟通能力和团队协作精神。	滴滴	2000人以上	汽车丨出行	不需要融资	广阔平台诱人福利
