1299	Python工程师	https://www.lagou.com/jobs/6581876.html	Python Web开发工程师	docker|企业软件	15k-20k	全职	北京	海淀区	中关村大街15-11号B2层C02室（创业公社大厦）	大专及以上	3-5年	2020-04-03	〖岗位要求〗1.根据业务需求，可独立完成技术可行性报告、概要设计、详细设计、并撰写相关文档；2.搭建系统开发环境，完成系统框架与核心代码开发。〖任职要求〗1.熟悉python语言服务端开发，3年以上开发经验；2.熟练使用tornado等python框架，熟悉asyncio库，有自有B端项目经验者优先；3.具有良好的编程思想、沟通、团队合作精神、优秀的分析问题和解决问题的能力；4.学习能力强，乐于钻研，较强的抗压能力。【技能要求】1.自有B端产品经验；2.熟练使用tornado；3.web服务。	缔联科技	50-150人	企业服务	B轮	跟技术大牛一起遨游|下午茶零食
1300	算法工程师	https://www.lagou.com/jobs/6406379.html	nlp算法专家	电商|大数据|深度学习|NLP|人工智能|机器学习	30k-60k	全职	北京	朝阳区	望京大厦	本科及以上	应届毕业生	2020-04-06	职责描述：1、负责文本自然语言处理、自然语言生成，人机交互相关技术和方法研究2、负责业务域内大规模数据下的领域知识沉淀和应用、ontology构建等3、利用自然语言处理和图谱等技术和方法解决实际问题任职要求：1、扎实的算法基础，熟悉算法原理和机器学习基本理论，具备扎实的数学/统计学基础2、精通自然语言处理领域相关的知识与技能，对计算语义以及文本生成等有较深入理解3、掌握机器学习的常见算法，有深度学习、迁移学习、强化学习应用经验者或者高质量论文产出者优先4、优秀的工程实践能力，Java/Python/C++基础扎实，熟悉分布式计算Hadoop，Spark框架者优先5、良好的团队合作意识，对技术饱有热情	青年良品	500-2000人	移动互联网,电商	D轮及以上	薪资福利高|**团队无加班文化|环境好
1301	工艺工程师	https://www.lagou.com/jobs/6916175.html	PCB设计师(001248)	PCB工艺	6k-11k	全职	深圳	南山区	深圳市康佳研发大厦	大专及以上	3-5年	2020-04-03	岗位职责:1.设计PCB2.确认PCB样品及试用跟踪改进3.发放PCB资料，提交、跟踪PCB更改记录4.制作、发放试产PCB工艺文件，PCB加工问题反馈处理任职资格:招聘要求：1.电子类大专以上学历，具有两年以上PCB设计经验。2.熟练运用PadsLayout工具，掌握PCB设计规范和制作流程，了解PCB制板及贴装工艺。3.熟悉PADS软件英文专业术语，能熟练运用Word、Excel常用办公软件。	深圳康佳电子科技有限公司	2000人以上	电商,物联网	不需要融资	福利待遇好|试用期全薪|知识分享
1302	C++工程师	https://www.lagou.com/jobs/6663554.html	云存储高级研发工程师（C++）	移动互联网|C++|分布式	30k-60k	全职	北京	海淀区	小营西路33号 金山软件大厦	本科及以上	3-5年	2020-04-03	职位描述工作职责：1.设计、开发万亿级分布式存储系统，包括对象存储、NoSql数据库、文件存储；2.负责系统架构设计、开发与相关人员技术指导任职要求：1.计算机或相关专业本科以上学历，3年以上存储系统开发经验2.熟悉Linux/Unix平台上的C++语言编程、常用算法与数据结构，熟悉网络编程、多线程编程技术；3.熟悉raft等常用数据一致性协议优先；4.有ceph、hdfs、hbase等分布式存储系统开发经验优先；5.有leveldb、rocksdb等存储引擎开发经验优先；6.有CIFS、NFS等协议开发经验者优先	金山云	2000人以上	移动互联网,数据服务	D轮及以上	绩效奖金免费三餐健身房员弹性时间
1303	Python工程师	https://www.lagou.com/jobs/6879092.html	深度学习系统python开发工程师	python爬虫	20k-40k	全职	北京	海淀区	北四环西路58号理想国际大厦	本科及以上	不限	2020-04-03	工作职责：1、参与深度学习模型生产系统的开发。工作的目标是为大数据工业级应用条件下的深度学习提供工具链。2、对深度学习最新算法与架构进行调研，实现，并进行改进。3、设计并实现python接口以支持公司内业务线的模型研发需求。4、开发工具以支持深度学习模型生产过程。任职资格：1、计算机专业基础知识扎实：包括操作系统、编译原理等2、熟悉Python编程，具有良好的编程习惯；3、有较强的进行代码调试和解决技术问题的能力。4、有较强的团队精神和沟通交流能力。5、对于主流DeepLearning框架有了解、或对深度学习视觉算法有了解者优先。地点：北京、上海	商汤科技	2000人以上	人工智能	C轮	人工智能
1304	工艺工程师	https://www.lagou.com/jobs/6956211.html	平面设计师	电商|广告营销|平面|平面设计|广告设计|画册	4k-6k	全职	海口	秀英区	海南省海口市	大专及以上	1-3年	2020-04-04	平面设计师要求1、根据项目需求，进行设计；2、从事商业画册设计、企业活动宣传设计、活动物料设计，广告设计等；3、确保设计作品与创意的一致性，并对设计细节进行完善；4、协助进行客户需求沟通及提案文件的设计完稿工作；任职要求：1、热爱电竞行业，喜欢玩电竞游戏；2、大专及以上学历相关专业毕业；3、逻辑思维清晰,做事认真、细致,表达能力强，具备良好的工作习惯，有创新意识，设计语言丰富；4、熟练掌握和运用Coreldraw或Illustrator、Photoshop等平面设计软件；5、能承受一定的工作压力，具有良好的沟通协调能力，具高度的责任心和有团队合作精神；6、具有1-3年以上工作经验或应变能力强、反应快、做事麻利愿意成长；7、有品牌案例、熟知广告制作相关工艺，能独立完成项目，有活动执行经验优先。有意向的请先把电子简历投至联系邮箱工作地点：海南省海口市	陆发电竞	15-50人	文娱丨内容	不需要融资	电竞
1305	C++工程师	https://www.lagou.com/jobs/6798424.html	c++开发工程师	C++|Windows|软件开发	15k-24k	全职	上海	浦东新区	上海市浦东新区杨高南路729号陆家嘴世纪金融广场1号楼12F	本科及以上	3-5年	2020-04-03	岗位职责：1、根据产品需求，完成港美股PC客户端软件功能；2、负责PC客户端的框架设计和性能调优；3、确保项目研发计划的进度和质量；4、参与公司其他业务功能开发。。任职要求：1、3-5年C/C++经验，扎实的C/C++基础；2、精通MFC、Qt框架等UI框架。3、熟练使用QtCreator/VisualStudio等IDE，能够熟练进行客户端软件开发及调试，熟悉windbg等调试工具。4、熟悉TCP、HTTP等常见的网络协议。5、良好的代码风格，熟悉常用的设计模式。6、有股票、金融类客户端软件开发经验优先。7、有多技术栈开发经验优先。【公司福利】1、公司在节假日（元旦、春节、劳动节、端午节、中秋节、国庆节）为员工发放节日福利。2、员工结婚生育赠送慰问礼物。3、按国家规定缴纳五险一金，公司还为员工额外购买了商业保险。4、每个季度有优秀员工评选！享受奖章、荣誉，公费培训，晋升机会！5、每月员工生日party，生日礼物，下午茶零食、户外拓展，聚餐、唱K；党员之家、员工书友会、篮球协会、演艺协会、公益俱乐部，满足每个员工不同的兴趣爱好！6、周末双休，带薪年假5天,享有国家法定节假日！	上海金大师网络科技有限公司	500-2000人	金融,文娱丨内容	上市公司	带薪年假|六险一金|各种福利
1306	算法工程师	https://www.lagou.com/jobs/6715842.html	推荐算法工程师	移动互联网|社交|Spark|数据挖掘|算法|Hadoop	15k-30k	全职	武汉	江夏区	光谷金融港B2栋2楼	本科及以上	3-5年	2020-04-03	岗位职责：1.推荐系统相关算法的设计、实现和优化；2.分析用户行为，挖掘用户兴趣，完善特征工程；3.深入理解业务和机器学习技术，优化模型和策略，持续提升推荐效果。岗位要求：1.具有扎实的数据结构及算法基础，熟悉机器学习/数据挖掘/自然语言处理等相关算法;2.熟悉Python、Java、C++等其中的一种或几种，有Hadoop/Spark等大数据开发经验;3.推荐系统、搜索排序、计算广告、机器学习相关技术有经验者优先;4.优秀的分析问题和解决问题的能力，对解决具有挑战性问题充满激情;5.良好的团队合作能力、沟通意识和抗压能力，责任心强。	皮皮pipi	50-150人	游戏,社交	不需要融资	氛围好|晋升空间大|技术大牛
1307	工艺工程师	https://www.lagou.com/jobs/6220514.html	室内设计师	CAD制图	7k-14k	全职	深圳	南山区	粤海街道高新南九道与高新南十道交汇处卫星大厦13层1305单元	大专及以上	3-5年	2020-04-03	岗位职责：1.收集并研究当前国内外各类优秀的家装设计。2.归纳并建立不同风格种类下色彩、建材、软装、家具款式的搭配方案。3.依据自身的研发需求，开拓建材及软装定制的供应商渠道。4.对公司网站、app、小程序上的案例、图片等内容输出做统一把控。岗位要求：1.在家装领域从事室内设计3年以上工作经验2.对设计品位要求较高，不例行公事套用行业中现成主流的模板套路3.熟悉硬装设计中的各类工艺4.熟悉地板、墙面、瓷砖、柜体、柜门、五金、石材、门窗、灯饰等材料，对每个品类高、中、低端的当下主流材料都有较深的了解5.热爱室内装修设计	伯曼科技	15-50人	移动互联网,电商	A轮	空间大|薪酬高
1308	Python工程师	https://www.lagou.com/jobs/5358148.html	资深Python后端开发工程师	后端|服务器端|Python	20k-35k	全职	上海	黄浦区	淮海中路93号大上海时代广场	本科及以上	3-5年	2020-04-03	福利描述：-工作时间10am-7pm，周末双休，提供免费餐食，无加班文化-正规缴纳五险一金，一年15天年假，无限制病假天数+高端医疗保险，男女员工比例平衡，人性化管理-团队小而精，氛围佳，股票激励-市中心办公，交通便利工作职责：-负责Glow核心业务的服务端开发工作-根据产品需求，进行系统设计与编码-持续优化业务架构，提升开发效率与服务端运行性能岗位要求：-计算机相关专业本科以上学历-2年以上服务端开发经验-良好的代码风格,有编写单元测试的习惯,擅长troubleshooting-主力编程语言Python,熟悉Flask,Celery,Sqlalchemy等常用类库-有MySQL,Redis,ElasticSearch等常用数据解决方案使用经验,能进行一定优化-有较强的英文交流能力，习惯阅读和编写英文文档我们鼓励技术分享,如果你对其他领域感兴趣iOS/Android,front-end,devops,cloudautomation,bigdata,performancetuning等等，相信也能有足够的成长。Glow技术博客：tech.glowing.com公司背景：-Glowwww.glowing.com是一家来自硅谷的科技公司，专注于女性健康以及数据科技领域。由Paypal联合创始人MaxLevchin以及前谷歌团队于2013年初成立。目前在旧金山以及上海都设有办公室，目标美国市场。其他成员大都来自腾讯，阿里，谷歌，微软，Oracle，Airbnb，MorganStanley，高盛等知名公司。团队定期举办内部技术分享会，Hackathon比赛等，技术氛围佳。-Glow的使命是建成世界一流的医疗平台和社区，通过科技、设计和服务提升人们的健康水平。公司成立之初就获得了投资过包括Facebook,SpaceX,Airbnb等的知名投资机构FoundersFund的A轮投资。在完成B轮共2300万美元的融资后，Glow的影响力持续增长，正准备下一步扩张。C轮融资进行中。-公司成立至今，已经积累超过千万的海外女性用户，并通过4款appEve,Glow,GlowNurture,GlowBaby和社区为用户提供极佳的健康管理体验-在美国各appstore长期5星好评，累计评论数过10万。作为一家成立才4年的初创公司，在2014年和2016年两次获得互联网知名奖项WebbyAwards。Eve在GooglePlayStore被评为2016年最佳app。Apple在上线其医疗开发平台CareKit时，选择了Glow作为首日发布品牌。-2017年初始，GlowFertilityProgram正式上线，与美国各大城市**的医院和诊所展开深入合作，为备孕中的女性用户提供更加专业的线下服务。-2017年10月，Glow来到中国。向国内用户提供高端海外辅助生育治疗服务。-2018年2月，Glow为中国用户设计的app*共乐孕*正式上线。-2018年6月，Glow与Apple共同为watchOS5制作了GlowBaby在iWatch上的应用，并在苹果开发者大会WWDC上演示。-更多产品和服务正在筹划进行中。	Glow	15-50人	移动互联网,医疗丨健康	B轮	产品优秀|团队出色|硅谷背景|技术氛围佳
1309	C++工程师	https://www.lagou.com/jobs/4997651.html	C++高级开发工程师	C++	25k-35k	全职	北京	海淀区	知春路紫金数码园5号楼一层	本科及以上	5-10年	2020-04-04	岗位职责：1.负责视频客户端软件的设计与开发2.负责音视频编、解码、播放的设计与开发任职要求：1.精通C/C++，MFC，Win32及相关技术2.精通网络编程与多线程开发模型3.有叁年以上PC客户端的开发经验，熟练使用VC/QT等相关工具4.良好的逻辑思维、沟通能力，学习能力5.具备团队合作精神，积极的工作态度和较强的责任心，良好的沟通和学习能力6.计算机相关专业本科或以上学历，有3年以上专职软件开发经验	翼鸥教育	150-500人	移动互联网,教育	B轮	免费三餐|不打卡|零食水果
1310	工艺工程师	https://www.lagou.com/jobs/6858006.html	电子维修工程师	电子/半导体/集成电路	4k-8k	全职	惠州	惠城区	沥林镇英光村718乡道碧桂园潼湖科技小镇科技产业楼B1栋一楼	大专及以上	3-5年	2020-04-04	职位描述：1、自主完成PCBA的故障排查工作，能够清晰定义故障现象，并初步判断故障范围；2、负责PCBA维修，能熟练地焊接各种电子元器件；3、负责生产测试的工装夹具制作与维护；4、协助电子产品的组装、调试及生产不良品维修；5、负责建立维修管理流程、规范；6、协助研发完成样机PCB焊接。岗位要求：1、大专以上学历，电子类相关专业，3年以上电子产品维修经验，有无人机硬件维修经优先录用；2、熟悉电子电路，基础电子电路分析等能力；具备专业电子知识及维修经验,了解SMT艺流程设计及工艺；3、能看懂线路图纸，会分析线路；会使用烙铁，熟悉焊接技术；4、会使用万用表、示波器等电路测量工具，熟悉各种电路元器件功能；5、能吃苦耐劳，能够良好协调及处理工作中的异常，有良好的沟通能力；6、工作认真负责，严谨细致，有较强的分析解决问题能力，好的团队协作精神。	大漠大智控	50-150人	其他	天使轮	五险一金|带薪年假|定期体检|发展空间大
1311	C++工程师	https://www.lagou.com/jobs/6364408.html	c++工程师	C++|Linux/Unix	6k-12k	实习	上海	浦东新区	金海路1000号金领之都56号楼11楼	本科及以上	应届毕业生	2020-03-26	1.负责机器人软件界面、通讯协议、控制流程等代阴编写；2.负责机器人软件相关技术文件编写；3.负责机器人软件系统调试、测试；4.上级分配的其它相关工作；5.根据项目的新需求，完善原有程序或开发新的程序。	擎朗	150-500人	移动互联网,硬件	A轮	五险一金
1312	Python工程师	https://www.lagou.com/jobs/4335142.html	Python开发工程师	云计算|Java|PHP|Python|云计算	15k-30k	全职	杭州	余杭区	仓前街道向往街1008号乐富海邦园	本科及以上	3-5年	2020-04-03	岗位职责：1.编写服务器端的程序，参与开发互联网产品，主要编程语言使用Python；2.围绕业务目标，发挥自己的创造力和生产力，寻求更有效的方式来实现业务需求；3.设计优化服务器业务逻辑以提供卓越的互联网海量用户体验。任职要求：1.3年以上中型以上互联网项目开发经验；2.熟悉Python性能调优的技术；3.熟悉Flask，Celery，Sqlalchemy等常用框架和库；4.熟悉常规关系型数据库及部分非关系型数据库；5.具备良好的代码规范和自主重构的习惯；6.工作态度认真，耐压，有责任感。	圆通	2000人以上	物流丨运输	上市公司	上市公司|前景好|氛围好|调薪机会多
1313	C++工程师	https://www.lagou.com/jobs/4340402.html	linux c/c++开发工程师	服务器端|C++|C|Linux/Unix	14k-28k	全职	深圳	南山区	南山智园A1栋	本科及以上	不限	2020-04-03	岗位职责：1、参与安全产品的整个研发过程（包括需求、预研、设计、开发、编码等）；2、独立分析、评估并解决问题，能够高效的解决研发层面的各种问题。岗位要求：1、本科及以上学历，1年以上软件研发工作经验；2、熟悉Linux操作系统，熟练掌握C/C++语言开发；3、对网络协议，如TCP/IP协议、HTTP协议等有一定的了解；4、对于经验更丰富、能力更强、有相关领域研发经验者，将会以更高级别招聘入职。最神秘、最酷炫、最有前（钱）景的网络安全行业；加入我们，来一场与黑客博奕、和**对抗的激战；	深信服科技集团	2000人以上	信息安全,企业服务	不需要融资	平台大|发展快|待遇好|福利棒
1314	工艺工程师	https://www.lagou.com/jobs/6835863.html	结构工程师	通信/网络设备|电子/半导体/集成电路	12k-15k	全职	深圳	龙华新区	深圳市龙华区龙华街道梅龙大道2203号大唐时代B座18楼1886室	本科及以上	1-3年	2020-04-04	职位描述：1、主要负责无人机的结构、零部件的设计开发；2、负责产品结构、零件的出图和打样；3、负责委外加工事宜，结构件定制、模具开发等过程中的工艺的确认和验证；4、完成产品原型的测试开发工作；5、协助生产、采购、飞行服务等部门，提供技术指导；6、撰写编制相关技术文档，如BOM表等。任职要求：1、本科及以上学历，1年以上结构设计及相关工作经验；2、熟练使用AutoCAD软件，熟练使用Proe、Solidworks、UG、CATIA任意一款3D结构软件，独立完成结构部件的设计开发和出图；3、熟悉碳纤维材料加工、金属材料加工、塑胶开模加工工艺，熟悉3D打印;4、有无人机设计经验的，或有无人机组装、调试等相关经验的优先；5、有独立思考能力，有创新精神，对产品设计充满热情，责任心强，有团队合作精神；6.大小周制，弹性工作。	大漠大智控	50-150人	其他	天使轮	五险一金|带薪年假|定期体检|发展空间大
1315	算法工程师	https://www.lagou.com/jobs/6174640.html	深度学习高级工程师	新零售|移动互联网|图像处理|模式识别|计算机视觉|机器学习	40k-70k	全职	上海	浦东新区	亮秀路112号Y1座	硕士及以上	5-10年	2020-04-06	职位描述：负责公司智能产品的研发，核心技术为：目标检测，物体识别，视频行为分析，人物跟踪等。职位要求：1.计算机或者电子类相关专业，硕士或者博士学历。2.了解机器学习算法，熟悉CNN，RCNN等网络的应用，以及优化技术。3.熟悉以下深度学习的框架应用中的任意一种：Caffe,Pytorch,TensorFlow。4.很强的写代码能力，python或者C5.熟悉图像识别算法，以及GPU计算相关经验的优先考虑。公司介绍：我们是做人工智能产品的技术型公司，为零售行业提供解决方案，已经在市场上取得领先地位，并得到了资本市场的认可。我们在图像商品识别的深度学习领域有世界前沿性的研究成果，在目标检测方面有独创的核心技术，为腾讯云，京东，小红书，搜狗，百联集团等**企业提供技术服务。创始团队来自百度硅谷深度学习研究院，核心技术团队来自国内外知名学府：清华，上海交大，加州伯克利，卡耐基梅隆，佐治亚理工，并曾在Google,Yahoo!,百度等互联网公司担任核心技术岗位。	海深科技	15-50人	移动互联网,电商	A轮	年终多薪|项目奖金|期权鼓励|团队优秀
1316	Python工程师	https://www.lagou.com/jobs/6798110.html	Python爬虫工程师	算法|MySQL|MongoDB	10k-15k	全职	深圳	福田区	新媒体广告产业园八楼	本科及以上	1-3年	2020-04-02	1、负责设计优化现有爬虫系统；2、负责爬虫系统不同模块的开发；3、负责网页信息和APP数据抽取、清洗、消重等工作，提升平台的抓取效率；4、实时监控爬虫的进度和警报反馈；任职要求1、1-3年Python爬虫工作经验，全日制统招本科及以上学历计算机相关专业；2、熟悉Python库的使用，掌握正则表达式、xpath、beautifulsoup4、css选择器等信息抽取技术，且熟练掌握scrapy框架、熟悉selenium、有scrapy-redis使用经验者优先考虑:3、熟悉常见反爬技术，能够处理各种反爬问题；4、掌握Linux基本操作，能够编写shell脚本优先，能独立解决简单常见的问题；5、熟悉MySQL、Redis、MongoDB等数据库操作；6、熟悉Git版本控制；7、有抓取过推特、Reddit或是外网站点经验者优先考虑；	陀螺财经	50-150人	广告营销,文娱丨内容	未融资	发展潜力大|牛逼团队|扁平化管理
1317	Python工程师	https://www.lagou.com/jobs/5734749.html	Python中级开发工程师	Python|MySQL	20k-25k	全职	北京	海淀区	西北旺东路10号院东区5号楼（互联网创新中心）	本科及以上	不限	2020-04-03	岗位职责：负责风控特征的设计和开发工作；任职要求：1、熟练使用Python语言；2、熟练掌握至少一门Pythonweb开发框架（Flask、Tornado等）；3、熟悉MySQL/PostgreSQL/Redis/MongoDB；4、熟悉Linix/Unix操作系统，熟练shell编程；能够独立完成项目上线、平台搭建等常用操作；5、较强的编码能力；6、具备较强的学习能力和责任心，良好的沟通能力、文档编写能力，有github开源项目者优先；7、喜欢钻研开源技术及自动化技术，具有较强的分析、解决应用问题的能力。	真融宝	500-2000人	金融	B轮	六险一金|有餐补|团队氛围好|成长空间大
1318	工艺工程师	https://www.lagou.com/jobs/5016269.html	高级电子工程师	PCB工艺|电路设计|PCB设计	8k-10k	全职	深圳	南山区	创业路怡海广场东座2705	大专及以上	3-5年	2020-04-04	1、从事机械自动化控制，小家电控制等等电子产品的整体方案的设计开发和管理，包括原理图设计、PCBLAYOUT、器件选型及功能实现，以及最终产品的调试和测试工作；2、对结构设计有深入的理解，能指导或配合结构工程师共同完成项目的设计。3、对软件方面有深入的理解，能指导或配合软件工程师共同完成项目的设计。4、编制新产品说明书及相关文件，包括：工艺图纸、配线图、BOM表和控制图等；5、配合解决生产及售后的技术问题任职资格1、电子专业或相关专业，专科及以上学历；英语良好；2、5年以上相关工作经历；3、熟练电子电路原理，掌握自动布局布线工具，熟悉单片机技术和C语言；熟练使用绘图软件；4、工作认真负责，严谨细致，有良好的创新精神和团队精神；良好的语言和书面表达能力。	福迈	50-150人	其他,人工智能	不需要融资	年底双薪|五险一金|包住宿
1319	算法工程师	https://www.lagou.com/jobs/6731688.html	推荐算法工程师	社交|后端	20k-40k	全职	上海	黄浦区	蒙自路757号歌斐中心36F	硕士及以上	不限	2020-04-04	1、负责社交产品数据体系建设，包括搭建数据仓库，建立指标体系，完成数据分析，报表开发及可视化呈现；2、负责推荐算法模型0-1完整设计搭建，包括特征，召回，排序，和混排的算法工作。熟悉模型建设前沿技术，富有针对业务场景独特创新的经验。通过算法优化不断提升推荐效率和多目标全局指标；3、负责用户标签系统建设，对用户生命周期进行管理，通过数据分析为产品提供策略指导，帮助用户增长；岗位要求：1、深入理解计算机原理，有扎实的数据结构和算法基础；2、良好的编码和文档习惯，对代码美感的追求孜孜不倦；3、熟悉Go/C/C++/Python等至少一门语言；4、熟练使用MySQL/Redis/Memcached/Kafka等常用存储技术，并熟悉其部署方案和实现原理；5、在成型的公司，做过完整的推荐项目，并且有过用户数据分析相关经验6、重度社交产品用户加分	引粒网络	15-50人	社交	天使轮	极佳的办公环境|发展空间前景好
