1	C++工程师	https://www.lagou.com/jobs/6761882.html	c++开发工程师 （初级）	C++|后端	6k-8k	全职	武汉	江夏区	光谷大道金融港	本科及以上	1-3年	2020-04-03	岗位职责：负责金融业务后台系统开发；任职要求：1.计算机相关专业，本科以上学历；2.软件知识结构全面，基础扎实，熟悉常用数据结构与算法，熟悉面向对象的开发方法；3.熟悉linux、UNIX等操作系统，了解Shell，能熟练使用Unix类系统下的C、C++进行编程；4.熟悉MYSQL数据库开发，了解NOSQL；5.具备较好的沟通能力，对待工作积极主动，有责任感。	优品财富管理有限公司	500-2000人	金融	未融资	大牛云集
2	Python工程师	https://www.lagou.com/jobs/3223944.html	Python工程师	MFC|QT|C++|Python	13k-20k	全职	深圳	南山区	嘉联支付大厦	本科及以上	3-5年	2020-04-06	1.2年以上Python编程经验2.熟悉Linux系统及Shell编程3.深刻理解软件设计，深入理解Python特性，编程风格良好4.熟悉Tornado或Django者优先	紫川软件	500-2000人	电商,金融	不需要融资	五险一金|员工旅游|周末双休
3	C++工程师	https://www.lagou.com/jobs/6367122.html	C++工程师	后端开发	25k-50k	全职	北京	海淀区	学清路东50米学清嘉创大厦B座1层	本科及以上	不限	2020-04-06	职位职责：1、参与公司商品搜索业务优化；2、负责AI、搜索等在线系统架构建设，优化系统稳定性、性能、容量、吞吐量；3、设计灵活的策略架构支持策略快速迭代和升级。职位要求：1、优秀的编码与代码控制能力,有扎实的数据结构和算法功底；2、熟悉linux开发环境，熟悉C++,精通网络编程、多线程编程；3、熟悉搜索引擎，对搜索引擎架构、大规模引擎有经验者优先；4、熟悉AI基本算法、AIinference框架有经验者优先；5、熟悉IntelMKL、NvidiaCuda、TensorRT的有经验者优先；6、承担过电商类搜索引擎工程或策略改进的工作者优先；7、热爱技术，持续学习，追求**。	字节跳动	2000人以上	文娱丨内容	C轮	六险一金|弹性工作|免费三餐|租房补贴
4	工艺工程师	https://www.lagou.com/jobs/6934285.html	工艺工程师	电路设计|硬件开发|系统集成	5k-8k	全职	上海	浦东新区	广丹路222弄2号楼	本科及以上	应届毕业生	2020-04-06	技能要求：生产过程工作流程定义工作职责:1、负责公司工艺技术工作和工艺管理工作。组织制定工艺技术工作近期和长远发展规划，并制定技术组织措施方案。2、编制产品的工艺文件，制定材料消耗工艺定额；根据工艺需要，设计工艺装备并负责工艺工装的验证和改进工作；3、承担工艺技术管理制度的起草和修订工作，组织相关人员搞好工艺管理，监督执行工艺纪律。4、完成各项临时任务任职资格:1、大专及以上学历，机械设计、机械设计制造及自动化相关专业，接受应届生2、具备机械设计或者机械设计及自动化等相关专业知识3、熟练掌握机械加工的基础知识，熟练掌握机械制图软件	纳米维景医疗科技	50-150人	医疗丨健康,软件开发	天使轮	二次调薪|补充医疗
5	Python工程师	https://www.lagou.com/jobs/6098993.html	Python开发工程师	后端开发	25k-40k	全职	上海	杨浦区	黄兴路2218号合生汇17楼	本科及以上	3-5年	2020-04-06	职位职责：1、设计和开发分布式程序，进行数据整理和分析工作；2、负责数据抽取、清洗、消重、数据结构化等工作；3、策略模型以及算法的更新维护，确保数据抽取准确、高效。职位要求：1、3年以上工作经验，精通python开发；2、熟悉多线程、网络编程，能熟练使用正则表达式；3、熟悉前端技术，HTML，JavaScript，Ajax等；4、熟练使用Mysql，熟悉Nosql数据库如Redis等，有hadoop经验更佳。	字节跳动	2000人以上	文娱丨内容	C轮	六险一金|弹性工作|免费三餐|餐补
6	C++工程师	https://www.lagou.com/jobs/6966656.html	c++工程师	C++	30k-50k	全职	上海	徐汇区	徐汇商务大厦	本科及以上	5-10年	2020-04-06	1、深入了解Linux/Unix，具有出色的数据结构和算法基础；2、精通LINUX下的网络编程及各类网络工具，熟悉Linux网络协议栈；3、拥有丰富的项目经验，具备良好的领导力和执行力，保证项目的高质量实施任职资格：1、计算机或相关专业，5年以上工作经验；2、具备良好的团队协作意识，自我驱动，热爱学习，能够承受一定压力	殷德营销策划	500-2000人	人工智能 房产家居	A轮	五险一金|年终奖|不定期国内外旅游
7	工艺工程师	https://www.lagou.com/jobs/6823028.html	工艺工程师	智能硬件	5k-10k	全职	广州	南沙区	榄核镇顺河村平顺街16号万隆工业园	大专及以上	3-5年	2020-04-03	岗位职责：1、负责新产品的导入、试产的安排、生产指导；开发过程对生产工艺、产品性能、组装进行分析研究，并给出改良改进方案；2、负责对现场产品作业指导书、BOM表、产品加工工艺、工程变更通知单（ECN）制作与管控；3、负责对现场产品制程辅助治工具、夹具的制作与维护；4、处理生产制造中产品问题，确保产品品质满足标准要求，满足交付期要求。5、完成上级安排的临时性工作.任职要求：1、大专及以上学历，工科专业毕业；2、3年以上塑胶、电子电器、机械结构产品PE或ME及工艺工程师经历；3、2年研发工程跟进、产品生产加工制造跟进工作经验；4、熟练使用office办公软件及CAD﹑Pro/E等工程绘图软件。	GANcube	150-500人	文娱丨内容,其他	未融资	优秀团队|五险一金|行业**|智能科技
8	算法工程师	https://www.lagou.com/jobs/6159327.html	推荐算法工程师	推荐|搜索|算法	20k-40k	全职	北京	海淀区	希格玛大厦	本科及以上	3-5年	2020-04-06	工作职责负责短视频个性化推荐算法的研究和实现，提升用户在短视频场景的视频观看量和观看时长。工作要求计算机（机器学习、自然处理等方向）、数学相关专业本科及以上学历，至少有2年相关专业工作背景；至少熟悉一种以上海量数据处理框架；有推荐系统、计算广告、大数据开发方面经验者优先考虑；有较强分析问题能力和数据敏感度，较强的工作激情，能承受一定的工作压力。	腾讯	2000人以上	社交	上市公司	腾讯
9	Python工程师	https://www.lagou.com/jobs/6844607.html	python开发工程师	Python|后端	20k-40k	全职	深圳	南山区	科技生态园	本科及以上	3-5年	2020-04-06	岗位职责：负责公司级研发及运营平台的开发，致力于提升公司在具体领域内的研发及运营效率，服务于公司所有研发&运维人员，涉及的内容包括软件源、配置中心等；负责研发效能相关平台的研发，致力于提升基础的研发效率，涉及的内容包括CI、发布、监控、日志数据平台等；负责运营体系、运营平台的建设，致力于提升部门业务的运营效率、运营质量。岗位要求：精通Unix/Linux操作系统、Bash、C/C++，良好的编码规范；具备2年以上开发经验，至少熟悉1种开发语言：PHP、Java、Rubby、Python、Perl；具有良好的学习能力、沟通能力、服务理念和合作精神；强烈的责任心与主动性，对所负责工作有owner意识，并能自我驱动成长；有数据仓库建设经验，熟悉python和web前端开发优先；有运维自动化、监控系统、发布系统、运营支撑系统等开发经验者优先；有大型分布式系统设计与开发经验者优先；	腾讯	2000人以上	社交	上市公司	大平台|福利待遇优厚
10	C++工程师	https://www.lagou.com/jobs/4648073.html	C++工程师	视频|MFC|QT|C++	15k-30k	全职	深圳	宝安区	深圳市宝安区海秀路龙光世纪大厦A座6层	本科及以上	不限	2020-04-06	岗位职责：1、负责专业级产品后期处理PC/Mac软件的开发2、负责消费级产品后期处理PC/Mac软件的开发3、负责专业级产品PC/Mac控制软件的开发任职要求：1、计算机相关专业，本科或以上学历；2、熟练掌握C++开发，985/211校招或者两年之内工作经验C++工程师；3、聪明，踏实，具有较好的逻辑思维能力和学习能力，较强的团队合作精神；4、具有PC端GUI软件开发经验，熟悉Qt、Duilib等C++UI框架者优先5、熟悉MVC/MVVM/MVP等设计模式6、关键字：C++,Qt/Duilib,GUI客户端，MVC/MVVM/MVP设计模式	Insta360影石	150-500人	硬件,移动互联网	D轮及以上	技术大牛|发展空间大|年底双薪|年终奖金
11	算法工程师	https://www.lagou.com/jobs/6290014.html	推荐算法工程师	Java|数据挖掘|Python	20k-40k	全职	深圳	南山区	万利达	本科及以上	不限	2020-04-06	岗位职责：1、负责Now直播数据体系建设，包括搭建数据仓库，建立指标体系，完成数据分析，报表开发及可视化呈现；2、负责个性化推荐，包括特征，召回，排序，和混排的算法工作。熟悉模型建设前沿技术，富有针对业务场景独特创新的经验。通过算法优化不断提升推荐效率和多目标全局指标。3、负责用户标签系统建设，对用户生命周期进行管理，通过数据分析为产品提供策略指导，帮助用户增长岗位要求：1、计算机或者数学相关专业；2、熟练掌握hiveSQL、python；熟悉GOJAVA，C，C++等至少一门编程语言；3、熟悉Hadoop/Spark/Hive/Storm等大数据处理系统，了解其运行原理；4、有较好的产品sense，具备较强的数据分析能力5、有推荐/广告/搜索相关的算法经验优先；有良好的逻辑思维和沟通协调能力	腾讯	2000人以上	社交	上市公司	福利待遇|工作环境|发展前景
12	工艺工程师	https://www.lagou.com/jobs/6963669.html	工艺工程师	汽车|硬件制造|工业设计	7k-10k	全职	烟台	开发区	秦淮河路369号	本科及以上	3-5年	2020-04-02	1、负责生产加工图纸的深化与优化;2、负责产品工艺文件的编制；3、负责产品材料预算文件的编制；4、负责产品检验标准的编制；5、负责与生产工艺师的工作对接；6、负责配合与协助OEM商产品批量生产的工艺改进，寻找产品生产最佳的方法；任职要求1、本科及以上学历，35岁以下，工艺、材料、机械，结构类专业;2、熟悉金属材料与钣金工艺，了解户外公共设施产品的材料、工艺与结构;3、有产品质量控制,跟进产品生产质量及验货的经验;4、能熟练使用办公软件与solidworks,proe等三维工程软件；CAD二维软件；5、要求有责任心，有担当，执行力强，思维清晰，原则性强，有较强的团队协作精神，具备外地出差条件；6、有户外照明灯具，户外城市家具，景观工程行业设计经验者优先。	欧力普公共艺术智造	15-50人	其他	未融资	机械设计|钣金钢结构
13	Python工程师	https://www.lagou.com/jobs/6149940.html	Python开发工程师（研发效率...	后端开发	25k-50k	全职	上海	闵行区	宜山路1999号科技绿洲三期24号楼	本科及以上	3-5年	2020-04-06	职位职责：1、负责开发字节跳动DevOps工程效率平台的后端模块；2、负责高性能、高可用构建系统建设；3、负责研发流水线插件设计和实现及能力介入落地；4、通过平台、工具、最佳实践提升业务研发的效率；5、包括但是不限于这些工作：编译、构建、二进制管理、持续集成、发布流程。职位要求：1、精通python，有丰富的工程经验；至少熟悉一种js前端技术框架，react优先；2、熟练掌握docker、registry的使用和优化；3、了解高并发、高可用设计，对微服务、serverless等应用架构有一定认识；4、熟悉常见的构建和和配置管理工具；5、对软件工程有较好的理解和实践。具备以下条件之一者优先:1、参与过大型容器云项目；2、熟悉并参与负责过大型项目的持续集成改进；3、有全栈工具开发经验、有私有云平台工具开发经验。	字节跳动	2000人以上	文娱丨内容	C轮	六险一金|弹性工作|免费三餐|租房补贴
14	C++工程师	https://www.lagou.com/jobs/4471534.html	C++工程师	金融|后端|分布式|Linux/Unix|C++	14k-25k	全职	深圳	福田区	天安数码城天经大厦A座603	本科及以上	1-3年	2020-04-06	岗位职责：1、从事金融类基础架构软件的设计和研发；2、承担分布式系统消息中间件子模块的设计、编码和测试；3、参与版本发布、技术支持，问题定位，缺陷修复，测试调优。任职要求：1、本科及以上学历，1年以上软件研发工作经验（优秀毕业生亦可）；2、熟悉使用STL和Boost库，有多线程编程经验；3、熟悉Linux系统、高性能网络编程、TCP/IP协议栈及ZeroMQ、Kafka或ActiveMQ等消息中间件；4、条理清晰，沟通表达能力良好，对技术有好奇心，善于研究学习；5、有高可用、高并发、低时延等分布式系统场景设计和研发经验者、有证券交易系统开发经验、熟悉证券交易业务流程或交易所接口者优先考虑；6、对于经验更丰富、能力更强，有相关领域开发经验者，将以更高级别招聘入职。	华锐金融技术	150-500人	移动互联网,金融	B轮	五险一金|股权激励|员工食堂|加班补贴
15	算法工程师	https://www.lagou.com/jobs/6451603.html	推荐算法工程师	算法	25k-40k	全职	北京	海淀区	学清路东50米学清嘉创大厦B座1层	本科及以上	1-3年	2020-04-06	职位职责：1、负责改进企业SaaS平台产品推荐系统，提升用户体验；2、主要工作包括：推荐模型改进，用户画像优化，文档理解等；3、参与打造新一代的企业智能产品。职位要求：1、本科及以上学历，1年以上推荐系统领域工作经验；2、扎实的编程基础，熟悉linux开发环境，熟悉python和C++优先；3、优秀的分析问题能力和解决问题能力，对解决具有挑战性问题充满激情；4、有扎实的数据结构和算法功底，熟悉推荐算法和具体落地，如特征挖掘、相关机器学习、统计原理等；5、有搜索/推荐相关领域的研发经验，并在某一个领域有深入积累将会成为加分项。	字节跳动	2000人以上	文娱丨内容	C轮	六险一金|高薪期权|弹性工作|免费三餐
16	工艺工程师	https://www.lagou.com/jobs/6285683.html	工艺工程师	其他	5k-8k	全职	中山	中山市市辖区	黄圃镇健智路2号	大专及以上	3-5年	2020-03-30	性别：不限；年龄：25~35；工作经验：3年以上；专业：机械、机电、模具、自动化等相关专业，大专以上学历；专业技能1.能较熟练使用AutoCAD、PROE/CERO绘图软件等；2.熟悉五金加工钣金折弯、冲压、焊接、打磨、模具制作工艺流程及技术要求；3.掌握机械原理，能独立进行受力分析、结构分析；4.熟悉家电产品常用装配工艺，能独立解决产品生产过程中的相关问题。5.了解常用质量管理工具，能主导进行较系统的质量分析和改善；6.沟通能力强，做事认真细心，责任心强，有一定的承压能力，注重团队协作；工作方向：产品生产工艺跟进、现场质量问题解决、工艺路线制定、作业规程编制。	波茵智能家居	500-2000人	房产家居	不需要融资	待遇优厚
17	Python工程师	https://www.lagou.com/jobs/6951634.html	python开发工程师	移动互联网|后端	10k-20k	全职	杭州	滨江区	杭州市滨江区信诚路555号科达投资大厦A座1701-1702室	本科及以上	1-3年	2020-04-06	统招二本以上学历，1年以上python开发经验。	易宝软件科技（南京）有限公司	150-500人	移动互联网	上市公司	项目奖金1-3个月
18	C++工程师	https://www.lagou.com/jobs/6751449.html	C++工程师	C++|Linux/Unix|后端|分布式	14k-25k	全职	上海	浦东新区	杨高南路1998号开伦聿缘9号楼	本科及以上	1-3年	2020-04-06	岗位职责：1、从事金融类基础架构软件的设计和研发；2、承担分布式系统消息中间件子模块的设计、编码和测试；3、参与版本发布、技术支持，问题定位，缺陷修复，测试调优。任职要求：1、本科及以上学历，1年以上软件研发工作经验（优秀毕业生亦可）；2、熟悉使用STL和Boost库，有多线程编程经验；3、熟悉Linux系统、高性能网络编程、TCP/IP协议栈及ZeroMQ、Kafka或ActiveMQ等消息中间件；4、条理清晰，沟通表达能力良好，对技术有好奇心，善于研究学习；5、有高可用、高并发、低时延等分布式系统场景设计和研发经验者、有证券交易系统开发经验、熟悉证券交易业务流程或交易所接口者优先考虑；6、对于经验更丰富、能力更强，有相关领域开发经验者，将以更高级别招聘入职	华锐金融技术	150-500人	移动互联网,金融	B轮	股权激励|加班补贴|扁平化管理|大牛多
19	算法工程师	https://www.lagou.com/jobs/6275817.html	推荐算法工程师	算法	25k-50k	全职	北京	海淀区	学清路东50米学清嘉创大厦B座1层	本科及以上	3-5年	2020-04-06	职位职责：1、负责改进企业SaaS平台产品推荐系统，提升用户体验；2、主要工作包括：推荐模型改进，用户画像优化，文档理解等；3、参与打造新一代的企业智能产品。职位要求：1、本科及以上学历，一年以上推荐系统领域工作经验；2、扎实的编程基础，熟悉linux开发环境，熟悉python和C++优先；3、优秀的分析问题能力和解决问题能力，对解决具有挑战性问题充满激情；4、有扎实的数据结构和算法功底，熟悉推荐算法和具体落地，如特征挖掘、相关机器学习、统计原理等；5、有搜索/推荐相关领域的研发经验，并在某一个领域有深入积累将会成为加分项。	字节跳动	2000人以上	文娱丨内容	C轮	六险一金|弹性工作|免费三餐|租房补贴
20	工艺工程师	https://www.lagou.com/jobs/6912492.html	工艺工程师	医疗健康	6k-8k	全职	深圳	南山区	桃源街道平山民企科技园6B栋2层201	大专及以上	1-3年	2020-03-31	素质要求：1.电子、电气、机械相关专业大专及以上学历；2.一年以上PCBA维修工作经验，一年以上测试相关工作经验，有医疗设备相关经验优先；3.精通AutoCAD，ProTel，了解电子、电气、机械相关基础知识；4.熟悉产品、工艺流程，有良好的协调能力和解决问题能力；5.熟悉测试仪器的使用及维护，测试环境的搭建。工作职责：1.样机试产中协助测试环境的搭建，并协助输出搭建方案；2.对测试方案提出改进并跟进；3.测试工装家具的验证，并提出改进意见；4.负责公司产线不良品及返修配件的分析、诊断、维修工作；5.测试及维修相关文件的编制。	普特生物医学	150-500人	医疗丨健康	不需要融资	周末双休|项目奖金|地铁沿线|发展机会
21	Python工程师	https://www.lagou.com/jobs/6815507.html	IEG-python后台开发工程师	游戏|移动互联网|后端|Python|C++|Linux/Unix	25k-50k	全职	深圳	南山区	科兴科学园	本科及以上	3-5年	2020-04-06	计算机相关专业本科及以上学历，3年以上后台开发经验；精通Python，3年以上Python后台开发经验，有良好的编码习惯；精通Python服务端编程，精通网络编程；熟悉Django/Tornado等web开发框架；熟悉大型分布式系统设计与开发，并具备MQ、NoSQL实战经验；熟悉Unix/Linux操作系统下的开发，部署，维护等工作；有GoogleCloudPlatform、IBMBluemix、AWS使用经验者优先；有CloudFoundry、ConPaaS等开源PaaS云平台开发经验者优先；具备良好的分析解决问题能力和团队合作能力；具有良好的学习能力，对互联网的新技术有很强的求知欲望；有激情，热爱Python，关注用户体验负责腾讯蓝鲸PaaS后台设计与开发；负责腾讯游戏运维支撑相关重点SaaS后台设计与开发；负责腾讯蓝鲸容器管理平台产品后台设计与开发。	腾讯	2000人以上	社交	上市公司	发展前景好|行业趋势|公司平台和资源
22	C++工程师	https://www.lagou.com/jobs/5926095.html	C++工程师	后端开发	30k-60k	全职	北京	海淀区	学清路东50米学清嘉创大厦B座1层	本科及以上	3-5年	2020-04-06	职位职责：1、开发跨平台高性能native客户端核心组件；2、负责沟通及创作工具的系统设计,实现,优化和演进；3、研究分析主流IM，优化实现方案，改进产品功能；4、负责设计和优化IM协议、弱网通信、推送、存储、网络并发、并行计算、加密以及安全等；5、保证工程质量和开发效率。职位要求：1、良好的系统编程能力.喜爱或有Rust经验以及扎实的C/C++功底更佳；2、喜爱关注新技术,愿意尝试更优解决方案；3、不设边界,愿意探索了解事物运转原理；4、熟悉开源社区；5、热衷自动化完成事情；6、关注代码设计，有持续学习习惯。	字节跳动	2000人以上	文娱丨内容	C轮	六险一金|高薪期权|弹性工作|免费三餐
23	算法工程师	https://www.lagou.com/jobs/6502969.html	推荐算法工程师	算法	25k-50k	全职	北京	海淀区	学清路东50米学清嘉创大厦B座1层	本科及以上	1-3年	2020-04-06	职位职责：1、利用机器学习技术，改进推荐系统，提升用户体验；2、主要工作包括：推荐模型改进，用户画像优化，文章特征优化等。职位要求：1、本科及以上学历，一年以上机器学习领域工作经验；2、扎实的编程基础，熟悉linux开发环境，熟悉python和C++优先；3、优秀的分析问题能力和解决问题能力，对解决具有挑战性问题充满激情；4、有扎实的数据结构和算法功底，熟悉机器学习、自然语言处理、深度学习中一项或多项。	字节跳动	2000人以上	文娱丨内容	C轮	弹性工作|免费三餐|租房补贴|职业大牛
24	工艺工程师	https://www.lagou.com/jobs/6911835.html	汽车技术支持工程师（总装工艺）	汽车	10k-15k	全职	广州	天河区	松岗大街8号小鹏汽车智能产业园区	本科及以上	3-5年	2020-04-05	主要职责：1.制订车辆维修性技术条件、维修性检查与验证、竞品车辆维修性优缺点分析报告；2.独立开展新产品维修性可行性分析，参与开展新产品竞争车型维修性分析；3.车辆设计阶段进行维修性虚拟验证，确保车辆下线达到基本维修要求；4.车辆试制阶段验证样车的实际维修性，提前规避量产车的相关问题；5.完成公司交办其他相关工作。基本任职要求：1.本科及以上学历，车辆工程、汽车运用、机械工程等相关专业，5年以上汽车研究院、整车厂以及汽车设计公司等相关工作经验；2.具备维修性工艺同步工程、工艺问题分析和解决能力；3.具备维修性工艺规划和设计能力；4.具有不小于其中一种能力：整车集成、总装工艺、车辆维修；5.英语CET-4级别及以上，能够熟练运用常用工程设计、办公软件；有较好的沟通、协调、组织、策划能力。	小鹏汽车	2000人以上	汽车丨出行	B轮	互联网大厂|行业领先
25	C++工程师	https://www.lagou.com/jobs/6905570.html	游戏C++服务器开发工程师	游戏|服务器端|C++	15k-30k	全职	上海	闵行区	陈行路2388号浦江科技广场3号楼3-4F	学历不限	3-5年	2020-04-06	职位描述：1、根据策划需求，完成工能够模块的设计、开发与调试；2、能够定位或解决线上问题；3、负责服务端后台相关工具开发。任职资格：1、3年及以上游戏服务器开发经验；2、熟练使用c/c++开发程序，熟悉常用数据结构和算法；3、熟悉多线程、网络编程；熟悉常见分布式服务器架构。4、良好的语言表达沟通能力，抗压能力；5、有gm等后台开发经验优先，有mmo开发经验优先。	恺英网络	500-2000人	移动互联网,游戏	上市公司	上市游戏公司|免费早晚餐|晋升空间
