440	算法工程师	https://www.lagou.com/jobs/6691749.html	高级算法工程师-推荐方向(T...	电商|广告营销|人工智能|搜索|推荐|算法	30k-60k	全职	上海	长宁区	娄山关路533号金虹桥国际中心	本科及以上	3-5年	2020-04-06	岗位职责：1、承担机器学习系统和算法的研发，并优化业务效果，包含建模、特征优化、模型优化等2、广告投放算法的研究与开发，包含广告排序、出价策略、CTR/CVR预估、反作弊算法等3、承担基础推荐算法的研发，提升用户的下载和使用活跃度4、推送系统的研究与开发，包含点击率预估、消息素材自动化生成、推送频率优化、推送策略优化等5、承担落地页的优化，包含用户兴趣匹配，推荐算法，排序算法优化，流量探索，拉新拉活优化等6、各种增长策略研究与探索，包括传播机制设计，社交网络挖掘和改进等，促进用户规模增长岗位要求：1、本科及以上学历，计算机、机器学习和数据挖掘等相关专业2、熟悉机器学习、深度学习、数据挖掘、推荐算法的各种算法知识，机器学习算法如LR，GBDT等，推荐算法如CF，FM等3、熟练掌握linux开发环境下C++或者JAVA语言的编程，有扎实的数据结构和算法功底4、充满激情，优秀的分析问题和解决问题的能力工作年限可适当放宽，不局限，都可以看	拼多多	2000人以上	电商,移动互联网	上市公司	核心业务团队
441	C++工程师	https://www.lagou.com/jobs/6951646.html	c++开发工程师	移动互联网|后端|C++	10k-20k	全职	西安	高新技术产业开发区	陕西省西安市高新区天谷八路环普产业园G1-11	本科及以上	1-3年	2020-04-06	统招二本以上学历，1年以上Ｃ++开发经验。	易宝软件科技（南京）有限公司	150-500人	移动互联网	上市公司	项目奖金1-3个月
442	Python工程师	https://www.lagou.com/jobs/6545101.html	Python高级工程师	企业服务|房产服务|后端|Python|爬虫|网络爬虫	10k-20k	全职	深圳	南山区	后海总部基地海信南方大厦18层	本科及以上	3-5年	2020-04-06	岗位职责：1.参与公司多个内部项目的业务逻辑层、数据层的设计，开发，优化2.负责应用的架构设计、功能实现并进行测试部署。3.与其他部门紧密配合，确保所负责业务的推进4.严格遵守团队的代码格式，编写易读、高质量、高效率的代码。职位要求：1.掌握Python语言。至少2年以上爬虫、web的开发经验。2.具有扎实的计算机基础和编程能力，熟悉常见的算法与数据结构3.熟悉Django/Tornado/Flask等web开发框架，具有分布式、多线程/协程/进程的编程经验4.熟悉Git/GitHub，通信协议TCP/HTTP及RESTful标准；5.熟悉MongoDB，了解Redis、MySQL等常用数据库，具备相关使用经验；6.强烈的责任心与主动性，对所负责工作有owner意识，并能自我驱动成长；加分项：1.有MongoDB调优经验2.有反爬虫对抗经验，熟悉Scrapy框架3.了解docker，k8s，有开源项目者	房极客	150-500人	移动互联网,企业服务	B轮	高配团队|发展机会|期权激励|扁平管理
443	C++工程师	https://www.lagou.com/jobs/6932101.html	c++后端开发工程师	移动互联网|互联网金融|后端|C++|C|Linux/Unix	13k-26k	全职	广州	番禺区	节能科技园总部大厦2号楼19层	本科及以上	不限	2020-04-06	目前公司在招的C++后端开发岗位分初、中、高三个等级（初级的7-15K，中级10-18K，高级15-25K），欢迎各位C++技术大神投递。【岗位职责】1、负责核心产品：证券行情分布式后端、金融量化平台基础组件等开发；2、参与系统架构优化、线程布局优化、内存优化等综合性工作；3、参与系统可用性、自动化、可维护性持续提升等工作。【岗位要求】初级：1、扎实的编程功底，并具有良好的编程习惯和编码风格；2、初步熟悉linux、windows等系统api；3、应届生在校有参与开源代码编写的优先，有大量github有效提交的优先；4、对于常用算法（快排、冒泡）有一定的认知基础；5、学习能力强，优秀的逻辑思维能力和自我管理能力。中级：1、有linux,win跨平台开发经验，对于常用系统api有深刻的理解；2、对于网络编程有熟练的掌握，能独立承担一个单独的开发任务，有完整的开发、发布到生产环境的经验优先；3、掌握epoll等异步模型开发，熟练掌握线程间的数据交互模型，有开发高并发，低延迟的系统的相关经验；4、熟练掌握mysql，tidb，redis等数据存储中间件优先。高级：1、有一定相关的团队管理经验。在严格控制工期下能够带领团队快速交付；2、至少有两种开发语言的开发经验；3、有分布式系统架构编写经验，在整个系统开发中有完整认知；4、熟练掌握linux,win底层运行的机制，在相关硬件资源约束下，能够设计出符合要求的系统架构。【关于我们】（我们是一个不需要融资的二十年创业团队）经传多赢（http://www.jingzhuan.cn）公司是互联网金融行业，全国行业排名前三，是有牌照的投资咨询公司（广州仅6家），主要从事证券辅助决策软件研发、金融数据挖掘与分析、金融信息服务等业务，于2013年全资收购了深圳市智多盈投资顾问有限公司（中国证监会核准[核准号：ZX0172]）。在这行业，我们已走过十多年，未来光芒待你来见证。【硬核优势】1、金融证券角度有深厚的行业沉淀，赋予广阔的视野和锻炼机会；2、公司未来几年在技术研发持续大力投入，赋予该职位广阔的发挥空间；3、公司奉行创业文化、利他文化，在人才培养角度相比其他公司更愿意投入，团队平均入职年限超过4年并且平均年龄超过30岁；4、该岗位由资深主管、总监直接指导，可以快速掌握大型C++项目核心技术，组内大牛密集，大部分都是C++客户端、服务器全栈全牛，技术氛围溢出。【加入我们，您将会享受到】1、薪资结构：基础薪资+奖金，全年12~17薪，优秀的您可以共享公司的经营业绩，晋升为事业合伙人可享受公司利润提成，优秀员工享受出国旅游机会；2、每日提供下午茶和水果零食，年度旅游+部门旅游+月度团建活动，各种节假日礼物福利；3、免费健身房，购买五险一金，各种保障齐全；4、年终发放千元孝心红包给父母；5、工作环境：工作环境温馨、舒适，员工之间关系和谐平等，对待新员工关心、友爱；6、透明晋升渠道：在工作中淬炼本职岗位技能，并用业余时间全面提升自我，技术中心产品线丰富，能够提供匹配员工职业发展的多种成长路线。【关于岗位的其他信息】1、上班时间：上午8:45—下午6:00，中休2小时，单休，法定节假日正常休息（高福利，高效率，创业文化）。2、上班地点：公司总部（番禺节能科技园总部中心2号楼19楼整层）我们还有几个措施改善大家的上班体验：1、给予超市场回报的薪水（也提供更快加速度的涨薪幅度）2、周六多为团建活动与专业知识交流会3、不鼓励加班，倡导高效开发文化如果你充满激情不甘于平凡，想要遇见美好的自己，欢迎加入我们，一起遇见美好的未来。	经传多赢	2000人以上	金融	不需要融资	年底多薪|绩效奖金|全栈全牛|技术雄厚
444	C++工程师	https://www.lagou.com/jobs/6954365.html	慧影-C++开发工程师	C++|服务器端|Linux/Unix	15k-25k	全职	杭州	滨江区	东流路700号	本科及以上	3-5年	2020-04-06	职位描述：1、根据项目需求、公司的相关规范，独立完成所负责模块的设计、开发工作；2、分析并解决软件开发、测试、部署、现场使用过程中出现的问题；3、独立对某个问题模块进行详细分析及优化并给出案例。职位要求：1、本科及以上学历，计算机相关专业，2年以上C++开发工作经验；2、精通C/C++语言，熟练掌握STL标准库中常用数据结构、算法及相关容器；3、熟练掌握MFC开发框架，熟悉TCP/IP协议和网络编程，具有良好的编码习惯；4、熟悉Linux跨平台开发，掌握相关调试技术.5、有视频相关开发经验者优先考虑。	海康威视	2000人以上	不限	上市公司	六险一金|新业务机会多
445	算法工程师	https://www.lagou.com/jobs/6887870.html	NLP高级算法工程师	信息安全|算法	20k-40k	全职	北京	海淀区	中关村发展大厦C401	硕士及以上	3-5年	2020-04-06	资格：1.计算机相关专业本科及以上学历；2.自然语言处理、机器学习、数据挖掘或相关专业；3.基础扎实，编码过关，熟悉常用的算法和数据结构；4.熟悉Linux操作系统开发环境，熟悉数据分析；【加分项】：1.在自然语言领域国际**会议等发表过论文；2.对NLP在信息安全领域的应用有浓厚兴趣	墨云科技	50-150人	信息安全	B轮	股票期权|弹性工作
446	算法工程师	https://www.lagou.com/jobs/6637968.html	算法工程师	数据挖掘|算法	20k-25k	全职	深圳	南山区	锦绣北街金众工业园201栋501	本科及以上	3-5年	2020-04-06	1、内部数据挖掘与推荐算法实现：用户价值挖掘模型、智能推荐排课系统搭建；2、外部数据挖掘：搭建选址模型3、搭建数据仓库；任职要求：1、数学、统计学、计算机等相关专业背景，全日制本科及以上学历；3年以上相关工作经验；2、熟悉机器学习算法；3、有推荐系统搭建、爬虫经验优先；4、熟练掌握python/java/C++/C/R之一语言，熟练掌握SQL；熟悉tensorflow等开源计算框架之一；5、具备较强独立思考能力，对数据敏感，热衷从数据中发现规律；积极主动，勇于接受挑战，富有创新精神；	超级猩猩健身	150-500人	移动互联网	D轮及以上	人性化管理|高颜值团队|健身福利
447	C++工程师	https://www.lagou.com/jobs/5706357.html	C++研发工程师	后端|服务器端	12k-20k	全职	北京	朝阳区	望京诚盈中心	学历不限	应届毕业生	2020-04-06	你将要负责1、负责数美核心产品功能和架构开发2、负责核心技术算法的研究、实现和优化3、负责前瞻技术的跟踪调研和产品创新希望你1、本科及以上学历，计算机相关专业2、深刻理解计算机数据结构和算法设计，熟悉C/C++、Java、Go、PHP编程语言3、优秀的分析问题和解决问题的能力，勇于解决难题3、热爱互联网，对互联网产品和技术有浓厚的兴趣，热衷于追求技术**与创新4、强烈的上进心和求知欲，较强的学习能力和沟通能力，具备良好的团队合作精神具有以下条件者优先：1、计算机领域相关的编程大赛获奖、专业期刊发表文章或者有发明专利等2、有一定项目经验，熟悉软件工程开发流程3、具备专业领域的计算机知识和技能：搜索引擎、数据挖掘/机器学习、多媒体、云计算、分布式系统等公司福利待遇有竞争力的薪酬期权奖励五险一金+商业保险午餐+晚餐补助交通+通讯+电脑补贴结婚+生育+丧葬+住院礼金伯乐奖金年假8天起+带薪病假年度体检、零食畅享、团队建设、生日会、弹性办公【关于数美】www.ishumei.com数美科技成立于2015年6月，致力于为全球客户提供专业的AI业务风控服务，由国内知名VC机构腾讯、襄禾资本、顺为资本、清流资本、BV百度风投联合投资，为互联网、互联网+、以及产业互联网客户提供全栈式、可信赖的业务风控解决方案。团队核心成员均来自百度、阿里、腾讯、360、小米等知名互联网企业，拥有10余年搜索、安全、语音等互联网在线产品研发经验。4年探索深耕，数美科技基于先进的人工智能技术，构建了全场景、全流程、全维度业务风控产品矩阵与秒级迭代全球SaaSAI风控服务网络，承载海量风险识别请求，以业务、模型、数据驱动的产品实现快速进化。数美科技结合多年黑产对抗经验打造全栈式实时智能风控引擎-天网，旨在为客户解决营销欺诈、支付风控、数据盗爬、欺诈广告等风险问题；同时，结合人工智能技术打造全栈式智能内容识别引擎-天净，为客户提供一站式的智能内容安全解决方案，帮助客户识别文本、图片、音频、视频、网页中出现的涉黄、涉政、低俗、色情、导流广告等问题，规避业务风险，提升运营效率。数美科技的业务风控服务已成功覆盖游戏、直播、新零售、地产、电商、视频、金融、媒体、旅游、出行、教育等行业。截至目前，数美科技已服务华润置地、苏宁、云闪付、酷狗、爱奇艺、映客、探探、vipkid、B站、汽车之家、游族、小红书、keep等上千家知名企业。…………………………………………………………………………了解更多：www.ishumei.com	数美	150-500人	企业服务,数据服务	C轮	快速发展|七险一金|薪酬给力|大牛导师
448	C++工程师	https://www.lagou.com/jobs/5374249.html	高级C++开发工程师	移动互联网|Linux/Unix|C++|服务器端	15k-30k	全职	广州	天河区	黄埔大道西122号星辉中心17楼	本科及以上	3-5年	2020-04-06	岗位职责：1.参与公司C/C++基础平台的优化、开发和维护；2.参与公司公共服务部件及共享组件的设计、开发和维护；3.负责服务器端技术难题的分析、定位和解决。任职要求：1.本科学历，计算机相关专业，扎实c/c++语言基础，３年以上开发经验；２.熟悉Linux编程环境，熟悉常用的网络/并发编程技术；３.数据库基础扎实，熟悉mysql应用开发；４.了解nosql技术，能熟练使用redis/mongodb/elasticsearch一种以上的开发；5.有分布式、大容量系统开发经验、了解RPC/MQ等技术者优先；6.良好的团队协作能力，积极主动、责任心强；较强的学习能力、分析问题和解决问题能力。	趣丸	500-2000人	游戏	不需要融资	大牛多|平台大|福利好|高薪
449	算法工程师	https://www.lagou.com/jobs/6811804.html	高级广告算法工程师	算法|数据挖掘|机器学习|建模	35k-50k	全职	上海	浦东新区	申江路5005弄星创科技广场	本科及以上	3-5年	2020-04-06	基于大规模用户行为数据，探索业界前沿深度学习算法，构建大规模AI模型，提高趣头条系所有产品的商业变现能力，如CTR/CVR预估，人群特征挖掘，文本和视觉内容理解等。工作内容包括但不局限于：1.广告CTR和CVR预估模型的优化，比如网络结构探索、特征构造、大规模实时学习等；2.针对不同广告产品形态的模型优化，如视频广告、互动广告、激励广告等；3.紧跟业界最新技术，并迅速转化到产品中，如BERT和XLNet；4.海量数据处理，分析与建模，深度挖掘数据上商业价值，使用分布式集群训练大规模模型；能力要求：1.具有4年以上算法工作经验，扎实的编程能力，熟悉Java/Python编程2.熟悉大规模数据处理，机器学习，深度学习等相关技术，并在实际工作中深度应用3.具备优秀的逻辑思考能力，能从海量数据中发现有价值的规律。对挑战和未知充满热情，积极解决和分析问题4.良好的团队合作精神，具有很强的自驱和学习能力，具备良好的沟通的能力5.具备广告算法点击率预估模型或者转化率预估模型相关经验优先6.具备广告投放相关技术的知识和经验，有商业变现相关策略工作背景优先	趣头条	500-2000人	文娱丨内容	上市公司	六险一金|带薪年假|绩效奖金|餐补等
450	算法工程师	https://www.lagou.com/jobs/6474350.html	算法工程师	人工智能|语音识别|搜索	18k-25k	全职	北京	朝阳区	望京诚盈中心	学历不限	应届毕业生	2020-04-06	岗位职责1、通过海量数据挖掘、机器学习等方法，构建用户画像、个性化推荐、预测、风险控制等系统；2、参与数据挖掘项目的设计、实现、算法调研、优化；3、调研并促进算法在公司多个业务领域的应用；任职要求:1、2020年应届，本科及以上学历，计算机、机器学习和模式识别相关专业；2、热爱计算机科学和互联网技术，对人工智能类产品有浓厚兴趣；3、熟悉linux开发环境，熟悉C++和Python语言优先；4、有扎实的数据结构和算法功底，熟悉机器学习、自然语言处理、数据挖掘、分布式计算、计算机视觉、计算机图形、语音识别与合成中一项或多项；5、对推荐系统、计算广告、搜索引擎、对话问答、图像和视频分析处理相关技术有经验者优先；6、优秀的分析问题和解决问题的能力，对解决具有挑战性问题充满激情。AI正在改变我们的工作和生活，也将成为企业的核心竞争力。AI解决方案切实地帮助企业解决各类业务场景的问题，成为企业在业务发展过程中必不可少的服务。数美科技推出“全栈式实时反欺诈”解决方案，服务于游戏、直播、社交、新零售、金融、旅游、等行业的领先企业，未来还将开拓更多人工智能解决方案。诚邀加入数美科技，一起成就人工智能toB企业级服务的大市场。【关于数美】www.ishumei.com数美科技成立于2015年6月，致力于为全球客户提供专业的AI业务风控服务，由国内知名VC机构奇虎360、百度风投、清流资本与顺为资本联合投资，为互联网、互联网+、以及产业互联网客户提供全栈式、可信赖的业务风控解决方案。团队核心成员均来自百度、阿里、腾讯、360、小米等知名互联网企业，拥有10余年搜索、安全、语音等互联网在线产品研发经验。4年探索深耕，数美科技基于先进的人工智能技术，构建了全场景、全流程、全维度业务风控产品矩阵与秒级迭代全球SaaSAI风控服务网络，承载海量风险识别请求，以业务、模型、数据驱动的产品实现快速进化。数美科技结合多年黑产对抗经验打造全栈式实时智能风控引擎-天网，旨在为客户解决营销欺诈、支付风控、数据盗爬、欺诈广告等风险问题；同时，结合人工智能技术打造全栈式智能内容识别引擎-天净，为客户提供一站式的智能内容安全解决方案，帮助客户识别文本、图片、音频、视频、网页中出现的涉黄、涉政、低俗、色情、导流广告等问题，规避业务风险，提升运营效率。数美科技的业务风控服务已成功覆盖游戏、直播、新零售、地产、电商、视频、金融、媒体、旅游、出行、教育等行业。截至目前，数美科技已服务华润置地、苏宁、云闪付、酷狗、爱奇艺、映客、探探、vipkid、B站、汽车之家、游族、小红书、keep等上千家知名企业。…………………………………………………………………………了解更多：www.ishumei.com	数美	150-500人	企业服务,数据服务	C轮	行业大咖|自由开放|Geek
451	C++工程师	https://www.lagou.com/jobs/6513975.html	C/C++开发工程师	C++|C	6k-12k	全职	东莞	东莞市市辖区	松山湖	本科及以上	1-3年	2020-04-06	岗位职责：1、嵌入式软件开发，涉及电源监控业务，包括但不限于：协议开发（modbus、电总、主从等）、南向设备接入（站点监控设备，例如门锁、电表、摄像头等接入）、界面呈现（LCD、WEB等）、业务逻辑等2、软件工程构建，包括但不限于编码规范整改、脚本构建规范岗位要求：1.熟悉C/C++语言，能独立完成编程任务；2.熟悉Linux操作系统的常用操作，熟悉Linux的C/C++开发和调试；3.熟悉相关脚本语言（Shell、Python等）。	上海易宝软件有限公司深圳分公司	150-500人	移动互联网	上市公司	五险一金|弹性工作|重点项目|免费班车
452	工艺工程师	https://www.lagou.com/jobs/6968389.html	包装设计师	电商|广告营销|包装设计|平面设计|包装|视觉	10k-15k	全职	广州	天河区	花城大道68号环球都会广场（IMP）3301	本科及以上	3-5年	2020-04-06	技能要求：包装设计，化妆品设计，化妆品包装设计岗位职责：1、全流程参与公司名膜壹号品牌产品包装设计执行，包括设计调研、概念设计、设计审核和产品生产监控；2、负责产品包装盒设计，物料标签设计，产品说明、设计规范应用等工作；3、根据公司的产品方向和定位，负责进行新产品开发和产品改良过程中的包装设计工作，输出设计规范文档，确保从预设到量产全过程产品包装及平面设计方面的品质输出。任职资格：1、全日制本科及以上学历，2年以上的包装设计经验，有模仿大牌护肤品/化妆品设计的经验；2、熟练使用PS、CDR、AI、3D等设计工具；设计熟练、有敏锐时尚触角，能独立完成产品包装项目,；熟悉印刷流程、相关制作工艺以及跟单实践经验；3、能很好地在设计中体现品牌设计理念，充分理解需求、设计思路符合市场产品的规律、研究包装设计行业新形式，融入企业产品包装设计。关于我们：1.年200%的企业增长速度，广阔的个人发展空间，让你从0到1陪伴品牌成长，让个人设计更有价值！2.CBD珠江新城的办公环境，让你坐在办公室就能直面小蛮腰，俯瞰海心沙，工作心情更加愉悦轻松；3.全勤奖+生日会+每月团建活动+节日礼品/奖金福利+五险一金+内购优惠，优秀者还能享受年终分红！	无添加	500-2000人	电商,移动互联网	不需要融资	甲方品牌|产品口碑|年终分红
453	C++工程师	https://www.lagou.com/jobs/4275962.html	资深C++/go资深研发工程师（...	电商|社交|分布式|Java	30k-60k	全职	上海	长宁区	娄山关路533号金虹桥国际中心	本科及以上	3-5年	2020-04-06	作为基础架构团队的一员，在拼多多，你每天将：在社交电商领域排名**的新兴独角兽公司中切身感受公司和个人同时高速成长的感觉；为几百人的研发团队提供架构系统和中间件支持，规划技术发展方向，带动团队技术氛围；面临海量存储、高并发、超大规模流量带来的技术压力，解决各个业务团队碰到的疑难杂症；在充满创造力和活力的年轻团队中，技术驱动业务，改变互联网电商行业！岗位职责：1.负责大规模分布式存储系统设计，负责核心模块代码编写；2.整合分析业务需求，提供最合适的存储解决方案；3.迎接业务增长带来的技术挑战，打造在高并发场景下的稳定，低延迟，高可用的存储系统。岗位要求：1.计算机相关专业本科及以上学历，2年以上研发经验，掌握C++/go语言；2.对redis/memcached/levelDB/rocksDB的一项或多项熟悉并有二次开发能力；3.熟悉网络编程，TCP/IP协议，异步I/O模型；4.熟悉分布式存储系统相关原理，在生产环境有快速定位问题的能力；5.具有目标感，很强的责任心和上进心，良好的沟通，团队协作能力；6.展示你的实力，一切条件皆免。	拼多多	2000人以上	电商,移动互联网	上市公司	技术挑战大|技术氛围好|福利待遇高
454	工艺工程师	https://www.lagou.com/jobs/2657321.html	产品ID设计师	工业设计	5k-9k	全职	深圳	宝安区	固戍二路华丰智慧创新港C座606室	大专及以上	1-3年	2020-04-06	职位描述：1、对公司下达的设计项目进行市场调研、品牌分析、定位设计方向。2、同小组成员一起进行头脑风暴会议。3、建模渲染、后期平面处理。4、外观手板、功能手板跟进确认。5、模具制作中、对表面工艺处理跟进。6、具有团队合作精神。任职条件：1、工业设计或美术设计专业、专科以上学历，有两年以上工作经验或应届毕业生均可。2、能熟练操作相关三维软件如（犀牛、PRO-E、KeyShot）进行建模和渲染，二维软件如（CorelDRAW、AI、PHOTOSHOP）。3、具备优秀的审美及形态把握能力、良好的原创设计能力。4、良好的创新意识，流行讯息敏锐度高，对市场流行趋势有感性认识。5、有良好的沟通能力，决策能力能精准把控客户的需求。	源三鼎设计	少于15人	医疗丨健康,其他	不需要融资	人性化管理模式和升职加薪平台。
