852	C++工程师	https://www.lagou.com/jobs/6944247.html	c++开发工程师	工具软件|C++|C#/.NET	10k-20k	全职	西安	高新技术产业开发区	研祥城市广场	本科及以上	1-3年	2020-04-05	岗位职责:1、参与项目设计，负责项目整体架构设计、需求分析、系统建模、设计开发和内部测试工作，并参与项目实施；2、根据系统设计方案、项目开发进度和任务分配，在规定的时间内完成高质量的编码工作；3、对所编写的模块或程序进行严格的综合测试，进行软件故障的诊断、定位、分析和调试，以实施产品测试方案，协助测试人员完成软件系统测试。任职要求:1、全日制本科及以上学历；2、要求精通C++/C#语言，熟悉.Net框架，熟练使用VS、SVN等开发工具；3、熟悉面向对象的程序设计思想，具有良好的逻辑思维能力、编程技巧和编码风格；4、有AutoCAD、Revit、Mirostation等CAD二次开发相关经验、熟悉计算机图形学经验者可优先考虑。5、有工程、建筑、机械相关设计经验者可优先考虑.	深高速顾问	500-2000人	其他	不需要融资	发展前景好
853	Python工程师	https://www.lagou.com/jobs/5612348.html	Python爬虫工程师	大数据	10k-18k	全职	深圳	南山区	深南大道9966威盛科技大厦1408	本科及以上	不限	2020-04-03	负责抓取电商、社交、新闻媒体、论坛类的数据；监控抓取数据的完整性；参与爬虫框架的开发。职位要求：本科及以上学历；熟悉Linux下的Python开发；熟悉常用数据库，包括MySQL、Redis、MongoDB等；熟悉Web开发技术、尤其是前端技术，有实际Web开发经验者优先；熟悉爬虫开发，了解常用爬虫框架如Scrapy、Requests、XPath等,了解常见的反爬手段及其应对措施；计算机相关专业优先；熟悉Node.js或者Java等其它语言者优先。公司福利：有竞争力的薪酬：工资、一年两次调薪机会、五险一金、年终奖、节假日福利、生日礼物等。既有情怀，又有“钱”途；合理的工作时间：我们有弹性工作时间制度，并追求使用技术去高效解决问题，不提倡加班；团队活动：YiMBA系列课程、每周的篮球和羽毛球运动，每周分享会，每月聚餐、生日会等。我们是一个有凝聚力的团队；年度体检：豪华体检，健康强壮的身体是工作的基础；零食饮料：不间断的供应丰富优质的零食饮料；年度旅游：前脚去泰国后脚去巴厘岛，随着团队的壮大，以后能去得更远；舒适的工作环境：我们有一个漂亮的办公室，开放式的设计和十分开阔壮观的窗景.......	一面数据	50-150人	移动互联网,数据服务	A轮	大数据人工智能|名校系大牛|技术氛围浓
854	C++工程师	https://www.lagou.com/jobs/6884614.html	高级C++开发工程师-视频编...	后端|C++|Android|IOS	20k-40k	全职	北京	海淀区	爱奇艺创新大厦	本科及以上	不限	2020-04-05	岗位职责:1、负责爱奇艺用户端APP短视频非编SDK的开发工作；2、跟进用户端反馈的非编问题，持续改进和优化。任职要求:1、统招本科及以上学历，计算机相关专业；2、扎实的计算机基础，熟悉常用的数据结构及算法；3、熟悉Android及iOS开发环境，精通基于C/C++的native层开发；4、熟悉常用的视频包装格式、H264编码格式；5、如下技能需具备其二，更多者加分：+熟练应用Mediacodec及Videotoolbox视频硬件编解码框架；+熟悉音频编解码处理、播放处理；+精通OpenGLES图形图像处理、渲染、合成，熟悉简单的特效算法；+全流程参与过媒体播放器开发；+具备完整的非编逻辑思维、信息组织与处理能力；6、具有较强的业务认知能力、强烈的责任感及较强的学习能力。温馨提醒：如果7天内您没有收到爱奇艺的面试邀请，那么目前我们不会安排您参加后续的面试环节，感谢您的理解和对爱奇艺的关注与认可。	爱奇艺	2000人以上	文娱丨内容	上市公司	大平台
855	工艺工程师	https://www.lagou.com/jobs/6675134.html	教具设计		10k-20k	全职	北京	海淀区	北四环西路56号辉煌时代大厦3层	本科及以上	3-5年	2020-04-06	职位职责：1、根据项目要求，与教研配合，设计、制作契合课程需要的外延物质产品，包括教材、操作手册、教具等；2、负责实物教具的材料、内容、排版的选择；3、设计前班-小学低年级教具设计；4、完成对已有产品的二次创意及深化设计；5、负责跟进教具的打样，管控项目进度，负责与生产商的沟通，并有效进行产品多次打样和方案修改的成果控制及进度协调。职位要求：1、统招本科及以上学历，有教育行业相关从业经验；2、有竞品礼盒设计经验的优先，有巧虎、逻辑狗的教具玩具设计经验优先，有玩具设计经验的优先；3、了解学龄前—小学低年级儿童的兴趣爱好，有坚实的产品造型设计基础，有敏锐的洞察力和创新能力；4、有优秀的设计能力，审美能力，并对儿童玩具/教具设计有一定经验；5、精通PS，AI，InDesign等软件，具备教育产品研发能力；6、有良好的执行能力，对产品结构、常用材质和制作工艺、流程有较全面的了解；7、善于沟通和理解需求，有一定的项目管理经验和良好的排期意识；8、认同企业文化，具有良好的职业操守、敏锐的市场意识和分析解决问题能力；	字节跳动	2000人以上	文娱丨内容	C轮	六险一金
856	算法工程师	https://www.lagou.com/jobs/6905034.html	AI算法专家	机器学习|计算机视觉|图像处理|语音识别	30k-45k	全职	深圳	南山区	科技南八路12号超多维科技大厦4楼	博士及以上	3-5年	2020-04-06	职位描述：1、AI算法的设计及优化，将核心算法应用到各种复杂的现实场景中；2､AI图像识别、语音识别等相关算法的研究与开发，完成项目的技术突破与革新；3、AI算法的技术布局、团队管理和重大研发项目的规划与方案设计；4、结合企业战略，探索AI在企业内产生价值的方法与路径。能力要求：1、博士及以上学历，机器学习、计算机视觉、图像处理等相关方向，在相关领域有3年以上的研究或工作经验；2、熟悉图像处理、模式识别和机器视觉常用算法，对深度学习有比较深入的研究；3、具有图像处理、姿态检测算法等相关算法研究与项目落地经历；4、能够跟进人工智能相关技术最新进展，了解并掌握深度学习新的平台的使用；5、具备广阔的前沿技术视野、行业影响力和创新精神。	悦动	150-500人	移动互联网,社交	C轮	C轮独角兽|亿级用户量|每日下午茶
857	C++工程师	https://www.lagou.com/jobs/6843830.html	CSIG- C++开发工程师	GO|Golang|架构师|后端	24k-45k	全职	深圳	南山区	腾讯大厦	本科及以上	5-10年	2020-04-06	负责协同办公系统，视频会议产品后台开发、研发、运营，主要工作包括：负责音视频云通讯的后台需求设计与开发；负责新的音视频产品后台设计与开发；负责音视频的架构优化重构,以及下一代音视频后台的技术研究；负责GME全球游戏语音引擎传输后台设计与开发;负责保障实时音视频通信系统的稳定运营;任职要求：1、熟练掌握C/C++语言，熟悉LINUX/UNIX开发环境，熟悉网络开发；2、有后台业务开发、维护经验，熟悉无线互联网服务及应用开发者优先;3、从事cdn、音视频通讯系统相关经验者优先；	腾讯	2000人以上	社交	上市公司	平台大|发展快|待遇好|福利棒
858	Python工程师	https://www.lagou.com/jobs/5907479.html	高级DevOps开发工程师/python	DevOps	15k-30k	全职	深圳	南山区	深圳市深圳市南山区科技园中区科苑路15号科兴科学园D栋1单元25层	学历不限	3-5年	2020-04-03	职位诱惑：腾讯系团队,扁平管理,六险一金职位描述：1、福利好，薪资高，技术牛人多，工作氛围好，上升空间大2、能深度参与互联网金融公司devops全流程建设，成为SRE工程师3、能了解到公有云原理、私有云建设等最前沿技术栈4、能学习到许多金融、证券行业投资知识工作职责：1、负责云运维自动化平台设计与开发，提供高效创新的一站式运维服务；2、负责监控系统开发、海量数据处理集群建设，提供AI智能监控、精准监控、业务链路监控、监控统计分析服务；3、负责后台自动化测试系统设计与开发，以及其他运维系统平台开发。任职要求：1、熟悉python，熟悉OOP编程模式，熟悉设计模式、开发规范，前后端都会优先；2、熟悉mysql，mongoDB，熟练使用SQL/NOSQL做为web后端数据存储；3、熟悉Django框架优先；4、熟悉类Unix系统架构、Tcp/Ip协议，掌握常用linux命令；5、具有大数据、运维自动化研发经验的优先；具有产品意识优先；6、有责任心，优秀的团队合作精神，良好的沟通表达和需求抽象能力；	富途	500-2000人	金融	上市公司	腾讯系团队|扁平管理|六险一金
859	算法工程师	https://www.lagou.com/jobs/6923599.html	NLG算法工程师	NLP	30k-60k	全职	北京	海淀区	数字传媒大厦1号楼	硕士及以上	5-10年	2020-04-06	工作职责:1.负责规划和搭建贝壳文本生成中台，面向所有业务提供抽取式、生成式、模板式三种文本生成能力，以及综合的文本生成解决方案；2.负责经纪人训练场讲稿生成、小贝助手智能回答、搜索理由、AI内容工厂等重点业务的文本生成效果持续优化。任职资格:1.自然语言处理/机器学习/计算机/数学相关专业，4年以上相关工作经验；2.优秀的算法基础和编码能力，熟悉linux环境，精通c/c++以及python、shell等脚本语言；3.在如下专业领域有丰富经验：分词、词性标注、新词发现、词义消歧、命名实体识别、句法分析、情感分析、主题模型、话题分析、事件发现、舆情分析、知识图谱，独立实现过复杂NLP系统；4.有1年以上文本生成应用的研究及开发落地经验；5.有很强的分析和解决问题的能力，思路清晰，学习能力强，善于归纳、总结、推理；6.抗压能力强，心里素质佳，有优秀的团队合作意识，良好的沟通能力以及团队协调能力。	贝壳	2000人以上	房产家居	D轮及以上	优质平台|团队|核心业务
860	C++工程师	https://www.lagou.com/jobs/5961292.html	软件工程师（C++）	C++	8k-15k	全职	深圳	南山区	深圳湾科技生态园二区九栋B座	本科及以上	1-3年	2020-04-05	岗位职责：1、负责图像处理、智能算法等新技术的效果评测、性能优化及产品化开发；2、负责完成新功能的软件设计和代码实现；3、对所开发工作内容的质量和进度负责；任职要求：1、本科学历，计算机相关专业，一年或以上开发工作经历2、熟练掌握C/C++语言，熟悉WindowsVS开发环境、嵌入式linux的交叉编译开发环境；3、熟悉以下二个开发调试工具之一：linuxQT、GDB、嵌入式GDB，熟悉shell环境下的常用命令4、有OpenCV等图像处理开发经验者优先考虑；5、有软件性能优化经验者优先；6、有安防行业相关开发经验优先考虑	同为数码	500-2000人	信息安全	不需要融资	上市公司五险一金节日福利晋升空间
861	算法工程师	https://www.lagou.com/jobs/6911084.html	大数据算法工程师	游戏|大数据|机器学习|算法|推荐|数据挖掘	30k-60k	全职	上海	长宁区	娄山关路金虹桥国际中心	本科及以上	3-5年	2020-04-06	工作职责：1.用户增长预测：在数据驱动下，善于从数据中挖掘增长点并进行策略制定和算法落地；2.推荐系统：负责个性化推荐系统算法和架构研发，搭建和优化推荐、排序系统，实现在相关产品中的精准推荐；3.广告优化：通过算法提高广告转化率和ROI。任职要求：1.计算机或数学相关专业毕业，有扎实的数据结构和算法基础，或者有较好的数学功底；有特征工程、数据建模、机器学习、最优化理论等相关基础；2.熟悉常用数据挖掘算法的实现与应用，掌握常用机器学习算法并有实战经验，包括但不限于LR、XGBoost、LightGBM、NN等，以及TensorFlow等框架；3.编程基础扎实，熟练掌握Python，并了解其它语言之一：C++、Java、Lua、C#；4.热衷了解和实战业界前沿技术，洞悉人工智能国际会议研究动态，不断提升自己在机器学习、运筹优化、机制设计、数理统计等方向的能力；5.其他优先条件：（1）有分布式机器学习和数据分析经验者优先；（2）在人工智能相关**会议有论文发表者优先；（3）编程能力杰出者优先；（4）Kaggle等比赛成绩优秀者优先。	友塔游戏	500-2000人	游戏	不需要融资	免费工作餐|弹性工作|带薪年假|定期体检
862	C++工程师	https://www.lagou.com/jobs/5870248.html	C++开发工程师（搜索引擎方向）	后端开发	30k-50k	全职	北京	海淀区	北京市海淀区丹棱街1号互联网金融中心	本科及以上	3-5年	2020-04-06	职位职责：1、参与公司商品搜索业务优化；2、负责搜索在线系统架构建设，优化系统稳定性、性能、容量、吞吐量，设计灵活的策略架构支持策略快速迭代和升级；3、负责搜索离线系统架构建设，优化离线数据流的稳定性和效率，推进离线数据快速、准确的应用到线上；4、抽象通用的搜索离在线系统架构和策略架构，用于快速支持电商搜索引擎。职位要求：1、优秀的编码与代码控制能力,有扎实的数据结构和算法功底；2、熟悉linux开发环境，熟悉C++,精通网络编程、多线程编程；3、熟悉搜索引擎，对搜索引擎架构、大规模引擎有经验者优先；4、承担过电商类搜索引擎工程或策略改进的工作者优先；5、热爱技术，持续学习，追求**。	字节跳动	2000人以上	文娱丨内容	C轮	六险一金|弹性工作|免费三餐|租房补贴
863	Python工程师	https://www.lagou.com/jobs/6877836.html	python研发工程师	企业服务|Python|C++	15k-25k	全职	北京	朝阳区	北京市朝阳区北苑路86号北美国际商务中心K2座	本科及以上	1-3年	2020-04-03	岗位职责：负责Web应用后端的设计与开发负责改进和优化整个Web应用后端架构，确保服务稳定、高效任职要求：1、211/985统招本科以上学历，计算机相关专业，了解常用数据结构及算法；2、1-3年及以上PythonWeb后端开发经验，熟悉Django或其他Web框架；3、对MVC及Restful有深刻认识，熟悉API设计，了解Web前端技术；4、熟悉关系型数据库，至少接触过一种NoSQL数据库；5、优秀的问题分析和解决能力，较强的沟通能力和学习能力；6、优秀的文档产出能力，包括但不限于设计文档、API使用文档等；7、产出高质量的代码，对代码设计和审美有自己的见解；8、有微服务搭建和使用经验者优先。	CloudIn	50-150人	移动互联网,数据服务	A轮	五险一金|福利好|地铁周边|试用全薪
864	算法工程师	https://www.lagou.com/jobs/5427767.html	语音算法工程师	模式识别|算法|语音合成|人工智能	25k-50k	全职	北京	海淀区	银谷大厦	本科及以上	3-5年	2020-04-06	职位描述：1、负责语音识别前端的算法的设计和优化2、负责语音识别声学模型和解码器设计和优化3、配合团队共同完成系统性能优化，算法定点优化任职要求：1、本科以上学历，计算机、数学，电子信息等相关专业毕业，具有四年以上语音前后端算法研究和开发经历者优先；2、精通C,C++和python等至少一门语言，具有很强的代码实现能力。3、熟悉至少AECAGCNSBSSDOABFSEDereverberation等一种算法，有实际项目开发经验者优先；4、熟悉深度学习算法模型，包括cnn、dnn、rnn、lstm等，有实际基于深度学习进行语音开发经验者优先；5、在ICASSPINTERSPEECH等上发表过相关论文者优先，有算法优化经验者优先。较强的学习能力,良好的沟通能力，以及团队合作意识	清微智能	50-150人	硬件	A轮	入职全薪|五险一金全额|补充医疗
865	工艺工程师	https://www.lagou.com/jobs/6814400.html	无人配送部-无人机PCB设计...	PCB工艺	20k-40k	全职	北京	朝阳区	望京国际研发园恒基伟业大厦B/C座	本科及以上	3-5年	2020-04-06	职责描述：1、负责产品单板PCB设计；2、参与PCB互连方案讨论及意见输出；3、负责PCB供应商考核评估并跟进PCB质量提升和成本把控；4、参与PCBA生产及供应商评估考核工作。任职要求：1.电子类相关专业，本科及以上学历；2.能够熟练使用EDA相关设计软件；3.熟悉PCB制造工艺、熟悉SMT生产工艺，以及HDI工艺设计要求及工艺规范；4.具备模拟电路、高速数字PCB设计经验，有SI、PI、EMC/EMI分析和解决能力者优先；5.具有较强的团队沟通能力、责任心、上进心。具有良好的学习能力，较为开放式的思维，能够在较大压力下很好的完成工作。	美团点评	2000人以上	消费生活	上市公司	自动驾驶|大落地场景|牛人云集|无人机
866	Python工程师	https://www.lagou.com/jobs/6943398.html	Python开发工程师	python爬虫	15k-25k	全职	杭州	西湖区	州市文一西路98号数娱大厦702室	本科及以上	3-5年	2020-04-03	职位描述：1、参与内网系统基础平台开发2、独立解决开发中遇到的疑难问题任职要求：1、2年以上Python开发经验，熟练使用Python标准库和流行的第三方库;2、熟练使用Django、Flask、Tornado等Web框架中的一种;3、熟练Bootstrap、Jquery等前端技术，有实际Reactjs使用的项目经验者优先本岗位需要同时参与前端和后端开发;4、熟悉使用Mysql数据库，对Sql性能优化有一定的经验;5、熟悉Git、Mongodb、Redis等相关技术;	兑吧	500-2000人	移动互联网	上市公司	项目靠谱|团队靠谱|平台发展好
867	C++工程师	https://www.lagou.com/jobs/6459921.html	c++开发工程师	游戏|Windows	15k-25k	全职	深圳	南山区	南山区朗山路25号永合高分子研发大厦3栋301	大专及以上	3-5年	2020-04-05	岗位职责:1、负责实现游戏服务器端应用逻辑；2、根据策划需求，独立开发游戏功能模块；3、熟悉基础的操作系统相关知识；4、使用C++开发维护服务器底层,开发游戏逻辑,开发周边支持工具等；任职要求：1、大专及以上学历，2年以上相关工作经验；2、扎实的C++基础；3、熟悉Windows平台、DirectX软件设计、stl；4、至少对一门脚本语言有较深刻的理解；5、对游戏引擎有一定研究和技术积累；6、责任心强，具备良好的学习能力和沟通能力	辉耀互娱	150-500人	游戏,移动互联网	A轮	双休|五险一金|节假日福利
868	Python工程师	https://www.lagou.com/jobs/6508423.html	后端工程师（Python/Golang）	后端|Golang|Python|服务器端	20k-40k	全职	上海	闵行区	紫星路588号2号楼309室	本科及以上	3-5年	2020-04-03	人工智能后端工程师职位简介赛舵智能是一家位于上海的人工智能初创公司，致力于在海外市场将人工智能运用于各个国家的不同工业领域。赛舵主要聚焦语音识别、语音合成、自然语言处理和语义理解相关技术和应用，希望能够改变和简化全球人们想用科技的方式，通过提升交互体验和效率来使得生活更美好。后端工程师岗位职责·研发人工智能产品；·编写SaaS服务；·编写满足客户需求的定制化功能；·维护、确保系统稳定性。任职需求·抗压能力强，适应创业公司节奏，希望博取未来；·精通Python语言或Go语言；·熟悉微服务架构、容器技术、MySQL、redis、网络编程等常见组件；·熟悉Linux操作系统；·熟悉高并发应用开发；·具有创新力和批判性思维；·良好的沟通能力；·负责任、有激情、认真以及结果导向；·有工程、技术相关的学位；更佳需求·有人工智能相关知识或经验；领域我们正在使用人工智能和大数据相关技术来开拓海外的科技市场。为了能够研发出满足海外市场和行业需求的产品、服务，我们需要你加入我们一起努力。团队和角色：研发工程师工作类别：全职	赛舵智能	15-50人	企业服务	天使轮	创业公司|从0-1|充分授权|博取未来
869	算法工程师	https://www.lagou.com/jobs/6658340.html	视频编解码算法工程师	视频编解码	15k-25k	全职	北京	朝阳区	北京朝阳区八里庄东里莱锦创意园CN05	硕士及以上	3-5年	2020-04-06	岗位职责：1、负责视频压缩基础算法研究和实现；2、推进深度学习在编解码算法中的应用，提高视频图像质量，降低视频压缩。任职要求：1、全日制硕士以上学历，计算机相关专业；2、3年以上相关工作经验；3、熟悉C/C++，Java，OC等计算机语言；4、性格开朗，好沟通；5、对相关视频压缩算法和标准有一定的了解和研究。	央视频融媒体	150-500人	文娱丨内容	不需要融资	带薪年假|包吃
870	C++工程师	https://www.lagou.com/jobs/6606608.html	C++研发工程师（上海）-抖音...		30k-60k	全职	上海	闵行区	宜山路1999号科技绿洲三期24号楼	本科及以上	不限	2020-04-06	职位职责：1、负责桌面端产品开发，编写高质量的代码；2、负责研发设计师设计流水线工具，提高生产效率；3、与设计师一起设计特效内容，支持制定特效内容技术标准。职位要求：1、优秀的编码与代码控制能力,良好的设计能力和编程习惯2、熟练掌握C++，对C++有深刻理解，有一定的跨平台开发经验3、有较好的产品意识4、熟悉Objective-C、QT、Windows开发优先5、熟悉GPUImage，AVFoundation，OpenGL，Metal，ARKit技术者优先6、具有全栈开发能力者优先7、对技术有极大的热情，学习能力强，责任心强，工作认真细致，具备良好的服务意识，具有良好的团队沟通与协作能力。	字节跳动	2000人以上	文娱丨内容	C轮	高薪期权
871	工艺工程师	https://www.lagou.com/jobs/6789967.html	无人机配送中心-高级硬件专家	硬件开发	25k-45k	全职	北京	朝阳区	望京国际研发园恒基伟业大厦B/C座	本科及以上	5-10年	2020-04-06	美团的使命是“帮大家吃得更好，生活更好”。作为中国领先的生活服务电子商务平台，公司拥有美团、大众点评、美团外卖、美团打车、摩拜单车等消费者熟知的App，服务涵盖餐饮、外卖、打车、共享单车、酒店旅游、电影、休闲娱乐等200多个品类，业务覆盖全国2800个县区市。2018年9月20日，美团点评（股票代码：3690.HK）正式在港交所挂牌上市。当前，美团战略聚焦Food+Platform，正以“吃”为核心，建设生活服务业从需求侧到供给侧的多层次科技服务平台。与此同时，美团正着力将自己建设成为一家社会企业，希望通过和党政部门、高校及研究院所、主流媒体、公益组织、生态伙伴等的深入合作，构建智慧城市，共创美好生活。职责描述：1.项目的需求收集，方案设计，单板开发，转产，量产支持；2.降成本，质量提升相关工作。任职要求：1.电子类相关专业，本科及以上学历；2.有过独立设计新项目单板经历，debug能力强，有很好的逻辑分析思维和判断能力，有项目量产并且维护经历；3.对常见的硬件知识，包括电源、时钟、常见高速接口（USB，MIPI,LVDS等）、复杂小系统（多核CPU/SOC/DSP+DDR+FLASH）熟悉，对MCU、ARM级别的处理器软硬件都精通优先；4.对SI,PI熟悉，有一定的工艺，EMC，DFM分析能力；5.用常见的调试设备，包括示波器，逻辑分析仪等；6.具有较强的团队沟通能力、责任心、上进心。具有良好的学习能力，能够在较大压力下很好的完成工作，具有较为开放式的思维，在校期间获得过省级，***比赛名次优先。	美团点评	2000人以上	消费生活	上市公司	自动驾驶前瞻技术|创新应用|大落地场景
